bert-cuda-autotuning.json
{"input": ["cuda -keys=cuda,gpu -max_num_threads=1024 -model=unknown -thread_warp_size=32", "dense_small_batch.gpu", [["TENSOR", [512, 768], "float32"], ["TENSOR", [768, 768], "float32"], null, "float32"], {}], "config": {"index": 16, "code_hash": null, "entity": [["tile_k", "sp", [-1, 384]]]}, "result": [[0.0023681427157894734], 0, 1.243821620941162, 1629001779.2774353], "version": 0.2, "tvm_version": "0.8.dev0"}
{"input": ["cuda -keys=cuda,gpu -max_num_threads=1024 -model=unknown -thread_warp_size=32", "dense_small_batch.gpu", [["TENSOR", [512, 768], "float32"], ["TENSOR", [768, 768], "float32"], null, "float32"], {}], "config": {"index": 15, "code_hash": null, "entity": [["tile_k", "sp", [-1, 256]]]}, "result": [[0.0015318724166666665], 0, 1.4004647731781006, 1629001780.4405367], "version": 0.2, "tvm_version": "0.8.dev0"}
{"input": ["cuda -keys=cuda,gpu -max_num_threads=1024 -model=unknown -thread_warp_size=32", "dense_small_batch.gpu", [["TENSOR", [512, 768], "float32"], ["TENSOR", [768, 768], "float32"], null, "float32"], {}], "config": {"index": 2, "code_hash": null, "entity": [["tile_k", "sp", [-1, 3]]]}, "result": [[0.00518131009375], 0, 1.1690688133239746, 1629001781.3094745], "version": 0.2, "tvm_version": "0.8.dev0"}
{"input": ["cuda -keys=cuda,gpu -max_num_threads=1024 -model=unknown -thread_warp_size=32", "dense_small_batch.gpu", [["TENSOR", [512, 768], "float32"], ["TENSOR", [768, 768], "float32"], null, "float32"], {}], "config": {"index": 11, "code_hash": null, "entity": [["tile_k", "sp", [-1, 64]]]}, "result": [[0.0007197789905660376], 0, 1.0366415977478027, 1629001782.0432787], "version": 0.2, "tvm_version": "0.8.dev0"}
{"input": ["cuda -keys=cuda,gpu -max_num_threads=1024 -model=unknown -thread_warp_size=32", "dense_small_batch.gpu", [["TENSOR", [512, 768], "float32"], ["TENSOR", [768, 768], "float32"], null, "float32"], {}], "config": {"index": 3, "code_hash": null, "entity": [["tile_k", "sp", [-1, 4]]]}, "result": [[0.0044315990882352945], 0, 1.0603351593017578, 1629001782.852194], "version": 0.2, "tvm_version": "0.8.dev0"}
{"input": ["cuda -keys=cuda,gpu -max_num_threads=1024 -model=unknown -thread_warp_size=32", "dense_small_batch.gpu", [["TENSOR", [512, 768], "float32"], ["TENSOR", [768, 768], "float32"], null, "float32"], {}], "config": {"index": 0, "code_hash": null, "entity": [["tile_k", "sp", [-1, 1]]]}, "result": [[0.013103853599999998], 0, 1.3346107006072998, 1629001783.895989], "version": 0.2, "tvm_version": "0.8.dev0"}
{"input": ["cuda -keys=cuda,gpu -max_num_threads=1024 -model=unknown -thread_warp_size=32", "dense_small_batch.gpu", [["TENSOR", [512, 768], "float32"], ["TENSOR", [768, 768], "float32"], null, "float32"], {}], "config": {"index": 7, "code_hash": null, "entity": [["tile_k", "sp", [-1, 16]]]}, "result": [[0.0010294417074829933], 0, 1.0234010219573975, 1629001784.638836], "version": 0.2, "tvm_version": "0.8.dev0"}
{"input": ["cuda -keys=cuda,gpu -max_num_threads=1024 -model=unknown -thread_warp_size=32", "dense_small_batch.gpu", [["TENSOR", [512, 768], "float32"], ["TENSOR", [768, 768], "float32"], null, "float32"], {}], "config": {"index": 8, "code_hash": null, "entity": [["tile_k", "sp", [-1, 24]]]}, "result": [[0.0008388111666666666], 0, 1.0672202110290527, 1629001785.355847], "version": 0.2, "tvm_version": "0.8.dev0"}
{"input": ["cuda -keys=cuda,gpu -max_num_threads=1024 -model=unknown -thread_warp_size=32", "dense_small_batch.gpu", [["TENSOR", [512, 768], "float32"], ["TENSOR", [768, 768], "float32"], null, "float32"], {}], "config": {"index": 13, "code_hash": null, "entity": [["tile_k", "sp", [-1, 128]]]}, "result": [[0.0009221123272727273], 0, 0.9889769554138184, 1629001786.0794659], "version": 0.2, "tvm_version": "0.8.dev0"}
{"input": ["cuda -keys=cuda,gpu -max_num_threads=1024 -model=unknown -thread_warp_size=32", "dense_small_batch.gpu", [["TENSOR", [512, 768], "float32"], ["TENSOR", [768, 768], "float32"], null, "float32"], {}], "config": {"index": 12, "code_hash": null, "entity": [["tile_k", "sp", [-1, 96]]]}, "result": [[0.0008413412277777778], 0, 1.0379185676574707, 1629001786.832529], "version": 0.2, "tvm_version": "0.8.dev0"}
{"input": ["cuda -keys=cuda,gpu -max_num_threads=1024 -model=unknown -thread_warp_size=32", "dense_small_batch.gpu", [["TENSOR", [512, 768], "float32"], ["TENSOR", [768, 768], "float32"], null, "float32"], {}], "config": {"index": 10, "code_hash": null, "entity": [["tile_k", "sp", [-1, 48]]]}, "result": [[0.0008401310111111111], 0, 0.9900152683258057, 1629001787.5807233], "version": 0.2, "tvm_version": "0.8.dev0"}
{"input": ["cuda -keys=cuda,gpu -max_num_threads=1024 -model=unknown -thread_warp_size=32", "dense_small_batch.gpu", [["TENSOR", [512, 768], "float32"], ["TENSOR", [768, 768], "float32"], null, "float32"], {}], "config": {"index": 5, "code_hash": null, "entity": [["tile_k", "sp", [-1, 8]]]}, "result": [[0.002210398333333333], 0, 0.9403746128082275, 1629001788.3277745], "version": 0.2, "tvm_version": "0.8.dev0"}
{"input": ["cuda -keys=cuda,gpu -max_num_threads=1024 -model=unknown -thread_warp_size=32", "dense_small_batch.gpu", [["TENSOR", [512, 768], "float32"], ["TENSOR", [768, 768], "float32"], null, "float32"], {}], "config": {"index": 14, "code_hash": null, "entity": [["tile_k", "sp", [-1, 192]]]}, "result": [[0.0012754866554621851], 0, 0.8537623882293701, 1629001789.660223], "version": 0.2, "tvm_version": "0.8.dev0"}
{"input": ["cuda -keys=cuda,gpu -max_num_threads=1024 -model=unknown -thread_warp_size=32", "dense_small_batch.gpu", [["TENSOR", [512, 768], "float32"], ["TENSOR", [768, 768], "float32"], null, "float32"], {}], "config": {"index": 6, "code_hash": null, "entity": [["tile_k", "sp", [-1, 12]]]}, "result": [[0.0013474910670391062], 0, 1.270315408706665, 1629001790.8026958], "version": 0.2, "tvm_version": "0.8.dev0"}
{"input": ["cuda -keys=cuda,gpu -max_num_threads=1024 -model=unknown -thread_warp_size=32", "dense_small_batch.gpu", [["TENSOR", [512, 768], "float32"], ["TENSOR", [768, 768], "float32"], null, "float32"], {}], "config": {"index": 1, "code_hash": null, "entity": [["tile_k", "sp", [-1, 2]]]}, "result": [[0.007046636125], 0, 1.2137854099273682, 1629001791.899981], "version": 0.2, "tvm_version": "0.8.dev0"}
{"input": ["cuda -keys=cuda,gpu -max_num_threads=1024 -model=unknown -thread_warp_size=32", "dense_small_batch.gpu", [["TENSOR", [512, 768], "float32"], ["TENSOR", [768, 768], "float32"], null, "float32"], {}], "config": {"index": 17, "code_hash": null, "entity": [["tile_k", "sp", [-1, 768]]]}, "result": [[0.00538781090625], 0, 1.046543836593628, 1629001792.7934835], "version": 0.2, "tvm_version": "0.8.dev0"}
{"input": ["cuda -keys=cuda,gpu -max_num_threads=1024 -model=unknown -thread_warp_size=32", "dense_small_batch.gpu", [["TENSOR", [512, 768], "float32"], ["TENSOR", [768, 768], "float32"], null, "float32"], {}], "config": {"index": 4, "code_hash": null, "entity": [["tile_k", "sp", [-1, 6]]]}, "result": [[0.0027570050909090905], 0, 0.9301924705505371, 1629001793.545301], "version": 0.2, "tvm_version": "0.8.dev0"}
{"input": ["cuda -keys=cuda,gpu -max_num_threads=1024 -model=unknown -thread_warp_size=32", "dense_small_batch.gpu", [["TENSOR", [512, 768], "float32"], ["TENSOR", [768, 768], "float32"], null, "float32"], {}], "config": {"index": 9, "code_hash": null, "entity": [["tile_k", "sp", [-1, 32]]]}, "result": [[0.0007146034905660377], 0, 0.883953332901001, 1629001794.2750561], "version": 0.2, "tvm_version": "0.8.dev0"}
{"input": ["cuda -keys=cuda,gpu -max_num_threads=1024 -model=unknown -thread_warp_size=32", "dense_large_batch.gpu", [["TENSOR", [512, 768], "float32"], ["TENSOR", [768, 768], "float32"], null, "float32"], {}], "config": {"index": 2862698, "code_hash": null, "entity": [["tile_x", "sp", [-1, 8, 1, 2]], ["tile_y", "sp", [-1, 2, 1, 12]], ["tile_k", "sp", [-1, 2, 2]]]}, "result": [[0.013295281499999997], 0, 3.0188939571380615, 1629001814.5445304], "version": 0.2, "tvm_version": "0.8.dev0"}
{"input": ["cuda -keys=cuda,gpu -max_num_threads=1024 -model=unknown -thread_warp_size=32", "dense_large_batch.gpu", [["TENSOR", [512, 768], "float32"], ["TENSOR", [768, 768], "float32"], null, "float32"], {}], "config": {"index": 354081, "code_hash": null, "entity": [["tile_x", "sp", [-1, 2, 1, 4]], ["tile_y", "sp", [-1, 2, 1, 4]], ["tile_k", "sp", [-1, 3, 1]]]}, "result": [[0.0031652608783783783], 0, 1.4053454399108887, 1629001838.5445716], "version": 0.2, "tvm_version": "0.8.dev0"}
{"input": ["cuda -keys=cuda,gpu -max_num_threads=1024 -model=unknown -thread_warp_size=32", "dense_large_batch.gpu", [["TENSOR", [512, 768], "float32"], ["TENSOR", [768, 768], "float32"], null, "float32"], {}], "config": {"index": 53560, "code_hash": null, "entity": [["tile_x", "sp", [-1, 1, 1, 4]], ["tile_y", "sp", [-1, 1, 1, 3]], ["tile_k", "sp", [-1, 1, 1]]]}, "result": [[0.01048902075], 0, 1.2144708633422852, 1629001934.5510664], "version": 0.2, "tvm_version": "0.8.dev0"}
{"input": ["cuda -keys=cuda,gpu -max_num_threads=1024 -model=unknown -thread_warp_size=32", "dense_large_batch.gpu", [["TENSOR", [512, 768], "float32"], ["TENSOR", [768, 768], "float32"], null, "float32"], {}], "config": {"index": 235016, "code_hash": null, "entity": [["tile_x", "sp", [-1, 2, 1, 2]], ["tile_y", "sp", [-1, 1, 1, 8]], ["tile_k", "sp", [-1, 2, 1]]]}, "result": [[0.00584054853125], 0, 1.3633818626403809, 1629001935.5374212], "version": 0.2, "tvm_version": "0.8.dev0"}
{"input": ["cuda -keys=cuda,gpu -max_num_threads=1024 -model=unknown -thread_warp_size=32", "dense_large_batch.gpu", [["TENSOR", [512, 768], "float32"], ["TENSOR", [768, 768], "float32"], null, "float32"], {}], "config": {"index": 81895, "code_hash": null, "entity": [["tile_x", "sp", [-1, 1, 1, 2]], ["tile_y", "sp", [-1, 1, 1, 6]], ["tile_k", "sp", [-1, 1, 1]]]}, "result": [[0.00981966445], 0, 1.2302651405334473, 1629001936.4357], "version": 0.2, "tvm_version": "0.8.dev0"}
{"input": ["cuda -keys=cuda,gpu -max_num_threads=1024 -model=unknown -thread_warp_size=32", "dense_large_batch.gpu", [["TENSOR", [512, 768], "float32"], ["TENSOR", [768, 768], "float32"], null, "float32"], {}], "config": {"index": 400182, "code_hash": null, "entity": [["tile_x", "sp", [-1, 4, 1, 1]], ["tile_y", "sp", [-1, 1, 1, 16]], ["tile_k", "sp", [-1, 3, 1]]]}, "result": [[0.0035498612686567167], 0, 1.7352564334869385, 1629001937.7017353], "version": 0.2, "tvm_version": "0.8.dev0"}
{"input": ["cuda -keys=cuda,gpu -max_num_threads=1024 -model=unknown -thread_warp_size=32", "dense_large_batch.gpu", [["TENSOR", [512, 768], "float32"], ["TENSOR", [768, 768], "float32"], null, "float32"], {}], "config": {"index": 354521, "code_hash": null, "entity": [["tile_x", "sp", [-1, 2, 1, 4]], ["tile_y", "sp", [-1, 4, 1, 4]], ["tile_k", "sp", [-1, 3, 1]]]}, "result": [[0.0025270612], 0, 1.5263392925262451, 1629001938.5566916], "version": 0.2, "tvm_version": "0.8.dev0"}
{"input": ["cuda -keys=cuda,gpu -max_num_threads=1024 -model=unknown -thread_warp_size=32", "dense_large_batch.gpu", [["TENSOR", [512, 768], "float32"], ["TENSOR", [768, 768], "float32"], null, "float32"], {}], "config": {"index": 81940, "code_hash": null, "entity": [["tile_x", "sp", [-1, 1, 1, 4]], ["tile_y", "sp", [-1, 1, 1, 6]], ["tile_k", "sp", [-1, 1, 1]]]}, "result": [[0.006197313218749999], 0, 1.3426618576049805, 1629001939.591158], "version": 0.2, "tvm_version": "0.8.dev0"}
{"input": ["cuda -keys=cuda,gpu -max_num_threads=1024 -model=unknown -thread_warp_size=32", "dense_large_batch.gpu", [["TENSOR", [512, 768], "float32"], ["TENSOR", [768, 768], "float32"], null, "float32"], {}], "config": {"index": 198981, "code_hash": null, "entity": [["tile_x", "sp", [-1, 2, 1, 4]], ["tile_y", "sp", [-1, 2, 1, 3]], ["tile_k", "sp", [-1, 2, 1]]]}, "result": [[0.004098634378378378], 0, 1.2741823196411133, 1629001940.4409726], "version": 0.2, "tvm_version": "0.8.dev0"}
{"input": ["cuda -keys=cuda,gpu -max_num_threads=1024 -model=unknown -thread_warp_size=32", "dense_large_batch.gpu", [["TENSOR", [512, 768], "float32"], ["TENSOR", [768, 768], "float32"], null, "float32"], {}], "config": {"index": 517497, "code_hash": null, "entity": [["tile_x", "sp", [-1, 4, 1, 2]], ["tile_y", "sp", [-1, 1, 1, 6]], ["tile_k", "sp", [-1, 4, 1]]]}, "result": [[0.004100137081081081], 0, 1.2915840148925781, 1629001941.2942622], "version": 0.2, "tvm_version": "0.8.dev0"}
{"input": ["cuda -keys=cuda,gpu -max_num_threads=1024 -model=unknown -thread_warp_size=32", "dense_large_batch.gpu", [["TENSOR", [512, 768], "float32"], ["TENSOR", [768, 768], "float32"], null, "float32"], {}], "config": {"index": 539222, "code_hash": null, "entity": [["tile_x", "sp", [-1, 4, 1, 1]], ["tile_y", "sp", [-1, 1, 1, 12]], ["tile_k", "sp", [-1, 4, 1]]]}, "result": [[0.0040962435405405406], 0, 1.322134017944336, 1629001942.1424735], "version": 0.2, "tvm_version": "0.8.dev0"}
{"input": ["cuda -keys=cuda,gpu -max_num_threads=1024 -model=unknown -thread_warp_size=32", "dense_large_batch.gpu", [["TENSOR", [512, 768], "float32"], ["TENSOR", [768, 768], "float32"], null, "float32"], {}], "config": {"index": 372296, "code_hash": null, "entity": [["tile_x", "sp", [-1, 2, 1, 2]], ["tile_y", "sp", [-1, 1, 1, 6]], ["tile_k", "sp", [-1, 3, 1]]]}, "result": [[0.00514498765625], 0, 1.2158923149108887, 1629001943.049846], "version": 0.2, "tvm_version": "0.8.dev0"}
{"input": ["cuda -keys=cuda,gpu -max_num_threads=1024 -model=unknown -thread_warp_size=32", "dense_large_batch.gpu", [["TENSOR", [512, 768], "float32"], ["TENSOR", [768, 768], "float32"], null, "float32"], {}], "config": {"index": 372516, "code_hash": null, "entity": [["tile_x", "sp", [-1, 2, 1, 2]], ["tile_y", "sp", [-1, 2, 1, 6]], ["tile_k", "sp", [-1, 3, 1]]]}, "result": [[0.0037861358000000006], 0, 1.2671246528625488, 1629001943.8744762], "version": 0.2, "tvm_version": "0.8.dev0"}
{"input": ["cuda -keys=cuda,gpu -max_num_threads=1024 -model=unknown -thread_warp_size=32", "dense_large_batch.gpu", [["TENSOR", [512, 768], "float32"], ["TENSOR", [768, 768], "float32"], null, "float32"], {}], "config": {"index": 344402, "code_hash": null, "entity": [["tile_x", "sp", [-1, 4, 1, 4]], ["tile_y", "sp", [-1, 4, 1, 3]], ["tile_k", "sp", [-1, 3, 1]]]}, "result": [[0.002211503811594203], 0, 1.4776475429534912, 1629001944.7514596], "version": 0.2, "tvm_version": "0.8.dev0"}
{"input": ["cuda -keys=cuda,gpu -max_num_threads=1024 -model=unknown -thread_warp_size=32", "dense_large_batch.gpu", [["TENSOR", [512, 768], "float32"], ["TENSOR", [768, 768], "float32"], null, "float32"], {}], "config": {"index": 380216, "code_hash": null, "entity": [["tile_x", "sp", [-1, 2, 1, 2]], ["tile_y", "sp", [-1, 1, 1, 8]], ["tile_k", "sp", [-1, 3, 1]]]}, "result": [[0.004108747621621622], 0, 1.202714204788208, 1629001946.8202353], "version": 0.2, "tvm_version": "0.8.dev0"}
{"input": ["cuda -keys=cuda,gpu -max_num_threads=1024 -model=unknown -thread_warp_size=32", "dense_large_batch.gpu", [["TENSOR", [512, 768], "float32"], ["TENSOR", [768, 768], "float32"], null, "float32"], {}], "config": {"index": 227095, "code_hash": null, "entity": [["tile_x", "sp", [-1, 1, 1, 2]], ["tile_y", "sp", [-1, 1, 1, 6]], ["tile_k", "sp", [-1, 2, 1]]]}, "result": [[0.00800866415], 0, 1.0686819553375244, 1629001947.6141307], "version": 0.2, "tvm_version": "0.8.dev0"}
{"input": ["cuda -keys=cuda,gpu -max_num_threads=1024 -model=unknown -thread_warp_size=32", "dense_large_batch.gpu", [["TENSOR", [512, 768], "float32"], ["TENSOR", [768, 768], "float32"], null, "float32"], {}], "config": {"index": 372297, "code_hash": null, "entity": [["tile_x", "sp", [-1, 4, 1, 2]], ["tile_y", "sp", [-1, 1, 1, 6]], ["tile_k", "sp", [-1, 3, 1]]]}, "result": [[0.0036928007317073167], 0, 1.225470781326294, 1629001948.455794], "version": 0.2, "tvm_version": "0.8.dev0"}
{"input": ["cuda -keys=cuda,gpu -max_num_threads=1024 -model=unknown -thread_warp_size=32", "dense_large_batch.gpu", [["TENSOR", [512, 768], "float32"], ["TENSOR", [768, 768], "float32"], null, "float32"], {}], "config": {"index": 2703417, "code_hash": null, "entity": [["tile_x", "sp", [-1, 4, 1, 2]], ["tile_y", "sp", [-1, 1, 1, 8]], ["tile_k", "sp", [-1, 1, 2]]]}, "result": [[0.003933109615384615], 0, 1.30466890335083, 1629001949.3052895], "version": 0.2, "tvm_version": "0.8.dev0"}
{"input": ["cuda -keys=cuda,gpu -max_num_threads=1024 -model=unknown -thread_warp_size=32", "dense_large_batch.gpu", [["TENSOR", [512, 768], "float32"], ["TENSOR", [768, 768], "float32"], null, "float32"], {}], "config": {"index": 5018696, "code_hash": null, "entity": [["tile_x", "sp", [-1, 2, 1, 2]], ["tile_y", "sp", [-1, 1, 1, 6]], ["tile_k", "sp", [-1, 1, 3]]]}, "result": [[0.0051646073437500006], 0, 1.2975647449493408, 1629001950.1877744], "version": 0.2, "tvm_version": "0.8.dev0"}
{"input": ["cuda -keys=cuda,gpu -max_num_threads=1024 -model=unknown -thread_warp_size=32", "dense_large_batch.gpu", [["TENSOR", [512, 768], "float32"], ["TENSOR", [768, 768], "float32"], null, "float32"], {}], "config": {"index": 555283, "code_hash": null, "entity": [["tile_x", "sp", [-1, 8, 1, 1]], ["tile_y", "sp", [-1, 1, 1, 24]], ["tile_k", "sp", [-1, 4, 1]]]}, "result": [[0.002369492930693069], 0, 2.0019102096557617, 1629001951.4878383], "version": 0.2, "tvm_version": "0.8.dev0"}
{"input": ["cuda -keys=cuda,gpu -max_num_threads=1024 -model=unknown -thread_warp_size=32", "dense_large_batch.gpu", [["TENSOR", [512, 768], "float32"], ["TENSOR", [768, 768], "float32"], null, "float32"], {}], "config": {"index": 2695497, "code_hash": null, "entity": [["tile_x", "sp", [-1, 4, 1, 2]], ["tile_y", "sp", [-1, 1, 1, 6]], ["tile_k", "sp", [-1, 1, 2]]]}, "result": [[0.004089907810810811], 0, 1.2659361362457275, 1629001952.330744], "version": 0.2, "tvm_version": "0.8.dev0"}
{"input": ["cuda -keys=cuda,gpu -max_num_threads=1024 -model=unknown -thread_warp_size=32", "dense_large_batch.gpu", [["TENSOR", [512, 768], "float32"], ["TENSOR", [768, 768], "float32"], null, "float32"], {}], "config": {"index": 2695496, "code_hash": null, "entity": [["tile_x", "sp", [-1, 2, 1, 2]], ["tile_y", "sp", [-1, 1, 1, 6]], ["tile_k", "sp", [-1, 1, 2]]]}, "result": [[0.0054080776562499995], 0, 1.2872827053070068, 1629001953.269808], "version": 0.2, "tvm_version": "0.8.dev0"}
{"input": ["cuda -keys=cuda,gpu -max_num_threads=1024 -model=unknown -thread_warp_size=32", "dense_large_batch.gpu", [["TENSOR", [512, 768], "float32"], ["TENSOR", [768, 768], "float32"], null, "float32"], {}], "config": {"index": 380437, "code_hash": null, "entity": [["tile_x", "sp", [-1, 4, 1, 2]], ["tile_y", "sp", [-1, 2, 1, 8]], ["tile_k", "sp", [-1, 3, 1]]]}, "result": [[0.00261715075], 0, 1.825671672821045, 1629001954.5175982], "version": 0.2, "tvm_version": "0.8.dev0"}
{"input": ["cuda -keys=cuda,gpu -max_num_threads=1024 -model=unknown -thread_warp_size=32", "dense_large_batch.gpu", [["TENSOR", [512, 768], "float32"], ["TENSOR", [768, 768], "float32"], null, "float32"], {}], "config": {"index": 5018695, "code_hash": null, "entity": [["tile_x", "sp", [-1, 1, 1, 2]], ["tile_y", "sp", [-1, 1, 1, 6]], ["tile_k", "sp", [-1, 1, 3]]]}, "result": [[0.00896183805], 0, 1.1982574462890625, 1629001955.3624625], "version": 0.2, "tvm_version": "0.8.dev0"}
{"input": ["cuda -keys=cuda,gpu -max_num_threads=1024 -model=unknown -thread_warp_size=32", "dense_large_batch.gpu", [["TENSOR", [512, 768], "float32"], ["TENSOR", [768, 768], "float32"], null, "float32"], {}], "config": {"index": 517495, "code_hash": null, "entity": [["tile_x", "sp", [-1, 1, 1, 2]], ["tile_y", "sp", [-1, 1, 1, 6]], ["tile_k", "sp", [-1, 4, 1]]]}, "result": [[0.0077437409], 0, 1.0892393589019775, 1629001956.111181], "version": 0.2, "tvm_version": "0.8.dev0"}
{"input": ["cuda -keys=cuda,gpu -max_num_threads=1024 -model=unknown -thread_warp_size=32", "dense_large_batch.gpu", [["TENSOR", [512, 768], "float32"], ["TENSOR", [768, 768], "float32"], null, "float32"], {}], "config": {"index": 5018960, "code_hash": null, "entity": [["tile_x", "sp", [-1, 1, 1, 4]], ["tile_y", "sp", [-1, 2, 1, 6]], ["tile_k", "sp", [-1, 1, 3]]]}, "result": [[0.003813799525], 0, 1.2039129734039307, 1629001956.9444144], "version": 0.2, "tvm_version": "0.8.dev0"}
{"input": ["cuda -keys=cuda,gpu -max_num_threads=1024 -model=unknown -thread_warp_size=32", "dense_large_batch.gpu", [["TENSOR", [512, 768], "float32"], ["TENSOR", [768, 768], "float32"], null, "float32"], {}], "config": {"index": 5018917, "code_hash": null, "entity": [["tile_x", "sp", [-1, 4, 1, 2]], ["tile_y", "sp", [-1, 2, 1, 6]], ["tile_k", "sp", [-1, 1, 3]]]}, "result": [[0.002743843925], 0, 1.7518362998962402, 1629002055.459631], "version": 0.2, "tvm_version": "0.8.dev0"}
{"input": ["cuda -keys=cuda,gpu -max_num_threads=1024 -model=unknown -thread_warp_size=32", "dense_large_batch.gpu", [["TENSOR", [512, 768], "float32"], ["TENSOR", [768, 768], "float32"], null, "float32"], {}], "config": {"index": 372517, "code_hash": null, "entity": [["tile_x", "sp", [-1, 4, 1, 2]], ["tile_y", "sp", [-1, 2, 1, 6]], ["tile_k", "sp", [-1, 3, 1]]]}, "result": [[0.0027161778522727274], 0, 1.8578486442565918, 1629002056.7285461], "version": 0.2, "tvm_version": "0.8.dev0"}
{"input": ["cuda -keys=cuda,gpu -max_num_threads=1024 -model=unknown -thread_warp_size=32", "dense_large_batch.gpu", [["TENSOR", [512, 768], "float32"], ["TENSOR", [768, 768], "float32"], null, "float32"], {}], "config": {"index": 394022, "code_hash": null, "entity": [["tile_x", "sp", [-1, 4, 1, 1]], ["tile_y", "sp", [-1, 1, 1, 12]], ["tile_k", "sp", [-1, 3, 1]]]}, "result": [[0.003695794], 0, 1.4002768993377686, 1629002057.5807517], "version": 0.2, "tvm_version": "0.8.dev0"}
{"input": ["cuda -keys=cuda,gpu -max_num_threads=1024 -model=unknown -thread_warp_size=32", "dense_large_batch.gpu", [["TENSOR", [512, 768], "float32"], ["TENSOR", [768, 768], "float32"], null, "float32"], {}], "config": {"index": 235017, "code_hash": null, "entity": [["tile_x", "sp", [-1, 4, 1, 2]], ["tile_y", "sp", [-1, 1, 1, 8]], ["tile_k", "sp", [-1, 2, 1]]]}, "result": [[0.003925063282051283], 0, 1.3565444946289062, 1629002058.4438515], "version": 0.2, "tvm_version": "0.8.dev0"}
{"input": ["cuda -keys=cuda,gpu -max_num_threads=1024 -model=unknown -thread_warp_size=32", "dense_large_batch.gpu", [["TENSOR", [512, 768], "float32"], ["TENSOR", [768, 768], "float32"], null, "float32"], {}], "config": {"index": 5040422, "code_hash": null, "entity": [["tile_x", "sp", [-1, 4, 1, 1]], ["tile_y", "sp", [-1, 1, 1, 12]], ["tile_k", "sp", [-1, 1, 3]]]}, "result": [[0.0037345789756097563], 0, 1.3632190227508545, 1629002059.279496], "version": 0.2, "tvm_version": "0.8.dev0"}
{"input": ["cuda -keys=cuda,gpu -max_num_threads=1024 -model=unknown -thread_warp_size=32", "dense_large_batch.gpu", [["TENSOR", [512, 768], "float32"], ["TENSOR", [768, 768], "float32"], null, "float32"], {}], "config": {"index": 5046582, "code_hash": null, "entity": [["tile_x", "sp", [-1, 4, 1, 1]], ["tile_y", "sp", [-1, 1, 1, 16]], ["tile_k", "sp", [-1, 1, 3]]]}, "result": [[0.0035747436976744187], 0, 1.412013053894043, 1629002060.1217542], "version": 0.2, "tvm_version": "0.8.dev0"}
{"input": ["cuda -keys=cuda,gpu -max_num_threads=1024 -model=unknown -thread_warp_size=32", "dense_large_batch.gpu", [["TENSOR", [512, 768], "float32"], ["TENSOR", [768, 768], "float32"], null, "float32"], {}], "config": {"index": 380382, "code_hash": null, "entity": [["tile_x", "sp", [-1, 4, 1, 1]], ["tile_y", "sp", [-1, 2, 1, 8]], ["tile_k", "sp", [-1, 3, 1]]]}, "result": [[0.0035250203255813954], 0, 1.4027833938598633, 1629002060.9880722], "version": 0.2, "tvm_version": "0.8.dev0"}
{"input": ["cuda -keys=cuda,gpu -max_num_threads=1024 -model=unknown -thread_warp_size=32", "dense_large_batch.gpu", [["TENSOR", [512, 768], "float32"], ["TENSOR", [768, 768], "float32"], null, "float32"], {}], "config": {"index": 2717222, "code_hash": null, "entity": [["tile_x", "sp", [-1, 4, 1, 1]], ["tile_y", "sp", [-1, 1, 1, 12]], ["tile_k", "sp", [-1, 1, 2]]]}, "result": [[0.004205571722222222], 0, 1.3019721508026123, 1629002061.841663], "version": 0.2, "tvm_version": "0.8.dev0"}
{"input": ["cuda -keys=cuda,gpu -max_num_threads=1024 -model=unknown -thread_warp_size=32", "dense_large_batch.gpu", [["TENSOR", [512, 768], "float32"], ["TENSOR", [768, 768], "float32"], null, "float32"], {}], "config": {"index": 400183, "code_hash": null, "entity": [["tile_x", "sp", [-1, 8, 1, 1]], ["tile_y", "sp", [-1, 1, 1, 16]], ["tile_k", "sp", [-1, 3, 1]]]}, "result": [[0.0025142651999999995], 0, 1.429093837738037, 1629002062.6989841], "version": 0.2, "tvm_version": "0.8.dev0"}
{"input": ["cuda -keys=cuda,gpu -max_num_threads=1024 -model=unknown -thread_warp_size=32", "dense_large_batch.gpu", [["TENSOR", [512, 768], "float32"], ["TENSOR", [768, 768], "float32"], null, "float32"], {}], "config": {"index": 545383, "code_hash": null, "entity": [["tile_x", "sp", [-1, 8, 1, 1]], ["tile_y", "sp", [-1, 1, 1, 16]], ["tile_k", "sp", [-1, 4, 1]]]}, "result": [[0.002490387786885246], 0, 1.5495293140411377, 1629002063.5633965], "version": 0.2, "tvm_version": "0.8.dev0"}
{"input": ["cuda -keys=cuda,gpu -max_num_threads=1024 -model=unknown -thread_warp_size=32", "dense_large_batch.gpu", [["TENSOR", [512, 768], "float32"], ["TENSOR", [768, 768], "float32"], null, "float32"], {}], "config": {"index": 5018916, "code_hash": null, "entity": [["tile_x", "sp", [-1, 2, 1, 2]], ["tile_y", "sp", [-1, 2, 1, 6]], ["tile_k", "sp", [-1, 1, 3]]]}, "result": [[0.0037811703], 0, 1.30936598777771, 1629002064.4139314], "version": 0.2, "tvm_version": "0.8.dev0"}
{"input": ["cuda -keys=cuda,gpu -max_num_threads=1024 -model=unknown -thread_warp_size=32", "dense_large_batch.gpu", [["TENSOR", [512, 768], "float32"], ["TENSOR", [768, 768], "float32"], null, "float32"], {}], "config": {"index": 227097, "code_hash": null, "entity": [["tile_x", "sp", [-1, 4, 1, 2]], ["tile_y", "sp", [-1, 1, 1, 6]], ["tile_k", "sp", [-1, 2, 1]]]}, "result": [[0.004078145135135135], 0, 1.2511639595031738, 1629002065.2689018], "version": 0.2, "tvm_version": "0.8.dev0"}
{"input": ["cuda -keys=cuda,gpu -max_num_threads=1024 -model=unknown -thread_warp_size=32", "dense_large_batch.gpu", [["TENSOR", [512, 768], "float32"], ["TENSOR", [768, 768], "float32"], null, "float32"], {}], "config": {"index": 5018698, "code_hash": null, "entity": [["tile_x", "sp", [-1, 8, 1, 2]], ["tile_y", "sp", [-1, 1, 1, 6]], ["tile_k", "sp", [-1, 1, 3]]]}, "result": [[0.002981813431372549], 0, 1.3465559482574463, 1629002067.5936215], "version": 0.2, "tvm_version": "0.8.dev0"}
{"input": ["cuda -keys=cuda,gpu -max_num_threads=1024 -model=unknown -thread_warp_size=32", "dense_large_batch.gpu", [["TENSOR", [512, 768], "float32"], ["TENSOR", [768, 768], "float32"], null, "float32"], {}], "config": {"index": 372242, "code_hash": null, "entity": [["tile_x", "sp", [-1, 4, 1, 1]], ["tile_y", "sp", [-1, 1, 1, 6]], ["tile_k", "sp", [-1, 3, 1]]]}, "result": [[0.00515081265625], 0, 1.2275958061218262, 1629002068.516122], "version": 0.2, "tvm_version": "0.8.dev0"}
{"input": ["cuda -keys=cuda,gpu -max_num_threads=1024 -model=unknown -thread_warp_size=32", "dense_large_batch.gpu", [["TENSOR", [512, 768], "float32"], ["TENSOR", [768, 768], "float32"], null, "float32"], {}], "config": {"index": 2868583, "code_hash": null, "entity": [["tile_x", "sp", [-1, 8, 1, 1]], ["tile_y", "sp", [-1, 1, 1, 16]], ["tile_k", "sp", [-1, 2, 2]]]}, "result": [[0.0024924431803278685], 0, 1.5359303951263428, 1629002069.3742974], "version": 0.2, "tvm_version": "0.8.dev0"}
{"input": ["cuda -keys=cuda,gpu -max_num_threads=1024 -model=unknown -thread_warp_size=32", "dense_large_batch.gpu", [["TENSOR", [512, 768], "float32"], ["TENSOR", [768, 768], "float32"], null, "float32"], {}], "config": {"index": 5046583, "code_hash": null, "entity": [["tile_x", "sp", [-1, 8, 1, 1]], ["tile_y", "sp", [-1, 1, 1, 16]], ["tile_k", "sp", [-1, 1, 3]]]}, "result": [[0.0025144816833333333], 0, 1.5071954727172852, 1629002070.21636], "version": 0.2, "tvm_version": "0.8.dev0"}
{"input": ["cuda -keys=cuda,gpu -max_num_threads=1024 -model=unknown -thread_warp_size=32", "dense_large_batch.gpu", [["TENSOR", [512, 768], "float32"], ["TENSOR", [768, 768], "float32"], null, "float32"], {}], "config": {"index": 5026837, "code_hash": null, "entity": [["tile_x", "sp", [-1, 4, 1, 2]], ["tile_y", "sp", [-1, 2, 1, 8]], ["tile_k", "sp", [-1, 1, 3]]]}, "result": [[0.00260928675862069], 0, 1.4472196102142334, 1629002071.0580168], "version": 0.2, "tvm_version": "0.8.dev0"}
{"input": ["cuda -keys=cuda,gpu -max_num_threads=1024 -model=unknown -thread_warp_size=32", "dense_large_batch.gpu", [["TENSOR", [512, 768], "float32"], ["TENSOR", [768, 768], "float32"], null, "float32"], {}], "config": {"index": 354202, "code_hash": null, "entity": [["tile_x", "sp", [-1, 4, 1, 1]], ["tile_y", "sp", [-1, 3, 1, 4]], ["tile_k", "sp", [-1, 3, 1]]]}, "result": [[0.003741505048780488], 0, 1.3825981616973877, 1629002071.9238658], "version": 0.2, "tvm_version": "0.8.dev0"}
{"input": ["cuda -keys=cuda,gpu -max_num_threads=1024 -model=unknown -thread_warp_size=32", "dense_large_batch.gpu", [["TENSOR", [512, 768], "float32"], ["TENSOR", [768, 768], "float32"], null, "float32"], {}], "config": {"index": 372462, "code_hash": null, "entity": [["tile_x", "sp", [-1, 4, 1, 1]], ["tile_y", "sp", [-1, 2, 1, 6]], ["tile_k", "sp", [-1, 3, 1]]]}, "result": [[0.0037295481951219508], 0, 1.3472750186920166, 1629002072.76066], "version": 0.2, "tvm_version": "0.8.dev0"}
{"input": ["cuda -keys=cuda,gpu -max_num_threads=1024 -model=unknown -thread_warp_size=32", "dense_large_batch.gpu", [["TENSOR", [512, 768], "float32"], ["TENSOR", [768, 768], "float32"], null, "float32"], {}], "config": {"index": 5018697, "code_hash": null, "entity": [["tile_x", "sp", [-1, 4, 1, 2]], ["tile_y", "sp", [-1, 1, 1, 6]], ["tile_k", "sp", [-1, 1, 3]]]}, "result": [[0.003660521195121951], 0, 1.29180908203125, 1629002073.582652], "version": 0.2, "tvm_version": "0.8.dev0"}
{"input": ["cuda -keys=cuda,gpu -max_num_threads=1024 -model=unknown -thread_warp_size=32", "dense_large_batch.gpu", [["TENSOR", [512, 768], "float32"], ["TENSOR", [768, 768], "float32"], null, "float32"], {}], "config": {"index": 539223, "code_hash": null, "entity": [["tile_x", "sp", [-1, 8, 1, 1]], ["tile_y", "sp", [-1, 1, 1, 12]], ["tile_k", "sp", [-1, 4, 1]]]}, "result": [[0.0030626711], 0, 1.5512382984161377, 1629002074.43557], "version": 0.2, "tvm_version": "0.8.dev0"}
{"input": ["cuda -keys=cuda,gpu -max_num_threads=1024 -model=unknown -thread_warp_size=32", "dense_large_batch.gpu", [["TENSOR", [512, 768], "float32"], ["TENSOR", [768, 768], "float32"], null, "float32"], {}], "config": {"index": 394023, "code_hash": null, "entity": [["tile_x", "sp", [-1, 8, 1, 1]], ["tile_y", "sp", [-1, 1, 1, 12]], ["tile_k", "sp", [-1, 3, 1]]]}, "result": [[0.002641812879310345], 0, 1.4009582996368408, 1629002075.290743], "version": 0.2, "tvm_version": "0.8.dev0"}
{"input": ["cuda -keys=cuda,gpu -max_num_threads=1024 -model=unknown -thread_warp_size=32", "dense_large_batch.gpu", [["TENSOR", [512, 768], "float32"], ["TENSOR", [768, 768], "float32"], null, "float32"], {}], "config": {"index": 5040423, "code_hash": null, "entity": [["tile_x", "sp", [-1, 8, 1, 1]], ["tile_y", "sp", [-1, 1, 1, 12]], ["tile_k", "sp", [-1, 1, 3]]]}, "result": [[0.0026620953157894733], 0, 1.3828248977661133, 1629002076.1428025], "version": 0.2, "tvm_version": "0.8.dev0"}
{"input": ["cuda -keys=cuda,gpu -max_num_threads=1024 -model=unknown -thread_warp_size=32", "dense_large_batch.gpu", [["TENSOR", [512, 768], "float32"], ["TENSOR", [768, 768], "float32"], null, "float32"], {}], "config": {"index": 2862423, "code_hash": null, "entity": [["tile_x", "sp", [-1, 8, 1, 1]], ["tile_y", "sp", [-1, 1, 1, 12]], ["tile_k", "sp", [-1, 2, 2]]]}, "result": [[0.0030592361139240506], 0, 1.9269120693206787, 1629002077.4122214], "version": 0.2, "tvm_version": "0.8.dev0"}
{"input": ["cuda -keys=cuda,gpu -max_num_threads=1024 -model=unknown -thread_warp_size=32", "dense_large_batch.gpu", [["TENSOR", [512, 768], "float32"], ["TENSOR", [768, 768], "float32"], null, "float32"], {}], "config": {"index": 499457, "code_hash": null, "entity": [["tile_x", "sp", [-1, 4, 1, 2]], ["tile_y", "sp", [-1, 3, 1, 4]], ["tile_k", "sp", [-1, 4, 1]]]}, "result": [[0.003131116632653061], 0, 1.6653718948364258, 1629002079.6072447], "version": 0.2, "tvm_version": "0.8.dev0"}
{"input": ["cuda -keys=cuda,gpu -max_num_threads=1024 -model=unknown -thread_warp_size=32", "dense_large_batch.gpu", [["TENSOR", [512, 768], "float32"], ["TENSOR", [768, 768], "float32"], null, "float32"], {}], "config": {"index": 5018918, "code_hash": null, "entity": [["tile_x", "sp", [-1, 8, 1, 2]], ["tile_y", "sp", [-1, 2, 1, 6]], ["tile_k", "sp", [-1, 1, 3]]]}, "result": [[0.002466175225806452], 0, 1.7026176452636719, 1629002080.4993172], "version": 0.2, "tvm_version": "0.8.dev0"}
{"input": ["cuda -keys=cuda,gpu -max_num_threads=1024 -model=unknown -thread_warp_size=32", "dense_large_batch.gpu", [["TENSOR", [512, 768], "float32"], ["TENSOR", [768, 768], "float32"], null, "float32"], {}], "config": {"index": 2677281, "code_hash": null, "entity": [["tile_x", "sp", [-1, 2, 1, 4]], ["tile_y", "sp", [-1, 2, 1, 4]], ["tile_k", "sp", [-1, 1, 2]]]}, "result": [[0.0039035608205128204], 0, 1.2822303771972656, 1629002081.3534894], "version": 0.2, "tvm_version": "0.8.dev0"}
{"input": ["cuda -keys=cuda,gpu -max_num_threads=1024 -model=unknown -thread_warp_size=32", "dense_large_batch.gpu", [["TENSOR", [512, 768], "float32"], ["TENSOR", [768, 768], "float32"], null, "float32"], {}], "config": {"index": 354037, "code_hash": null, "entity": [["tile_x", "sp", [-1, 4, 1, 2]], ["tile_y", "sp", [-1, 2, 1, 4]], ["tile_k", "sp", [-1, 3, 1]]]}, "result": [[0.0029418633846153845], 0, 1.3523790836334229, 1629002082.2028253], "version": 0.2, "tvm_version": "0.8.dev0"}
{"input": ["cuda -keys=cuda,gpu -max_num_threads=1024 -model=unknown -thread_warp_size=32", "dense_large_batch.gpu", [["TENSOR", [512, 768], "float32"], ["TENSOR", [768, 768], "float32"], null, "float32"], {}], "config": {"index": 6353383, "code_hash": null, "entity": [["tile_x", "sp", [-1, 8, 1, 1]], ["tile_y", "sp", [-1, 1, 1, 16]], ["tile_k", "sp", [-1, 1, 4]]]}, "result": [[0.0024848348453608247], 0, 2.0860092639923096, 1629002083.5085146], "version": 0.2, "tvm_version": "0.8.dev0"}
{"input": ["cuda -keys=cuda,gpu -max_num_threads=1024 -model=unknown -thread_warp_size=32", "dense_large_batch.gpu", [["TENSOR", [512, 768], "float32"], ["TENSOR", [768, 768], "float32"], null, "float32"], {}], "config": {"index": 353983, "code_hash": null, "entity": [["tile_x", "sp", [-1, 8, 1, 1]], ["tile_y", "sp", [-1, 2, 1, 4]], ["tile_k", "sp", [-1, 3, 1]]]}, "result": [[0.0029278740769230764], 0, 1.3703029155731201, 1629002084.3660326], "version": 0.2, "tvm_version": "0.8.dev0"}
{"input": ["cuda -keys=cuda,gpu -max_num_threads=1024 -model=unknown -thread_warp_size=32", "dense_large_batch.gpu", [["TENSOR", [512, 768], "float32"], ["TENSOR", [768, 768], "float32"], null, "float32"], {}], "config": {"index": 2695761, "code_hash": null, "entity": [["tile_x", "sp", [-1, 2, 1, 4]], ["tile_y", "sp", [-1, 2, 1, 6]], ["tile_k", "sp", [-1, 1, 2]]]}, "result": [[0.0031732631875000003], 0, 1.3819575309753418, 1629002085.2202532], "version": 0.2, "tvm_version": "0.8.dev0"}
{"input": ["cuda -keys=cuda,gpu -max_num_threads=1024 -model=unknown -thread_warp_size=32", "dense_large_batch.gpu", [["TENSOR", [512, 768], "float32"], ["TENSOR", [768, 768], "float32"], null, "float32"], {}], "config": {"index": 227317, "code_hash": null, "entity": [["tile_x", "sp", [-1, 4, 1, 2]], ["tile_y", "sp", [-1, 2, 1, 6]], ["tile_k", "sp", [-1, 2, 1]]]}, "result": [[0.0031639112708333333], 0, 1.435628890991211, 1629002086.0665765], "version": 0.2, "tvm_version": "0.8.dev0"}
{"input": ["cuda -keys=cuda,gpu -max_num_threads=1024 -model=unknown -thread_warp_size=32", "dense_large_batch.gpu", [["TENSOR", [512, 768], "float32"], ["TENSOR", [768, 768], "float32"], null, "float32"], {}], "config": {"index": 517662, "code_hash": null, "entity": [["tile_x", "sp", [-1, 4, 1, 1]], ["tile_y", "sp", [-1, 2, 1, 6]], ["tile_k", "sp", [-1, 4, 1]]]}, "result": [[0.004142956081081081], 0, 1.4400594234466553, 1629002086.913454], "version": 0.2, "tvm_version": "0.8.dev0"}
{"input": ["cuda -keys=cuda,gpu -max_num_threads=1024 -model=unknown -thread_warp_size=32", "dense_large_batch.gpu", [["TENSOR", [512, 768], "float32"], ["TENSOR", [768, 768], "float32"], null, "float32"], {}], "config": {"index": 344082, "code_hash": null, "entity": [["tile_x", "sp", [-1, 4, 1, 1]], ["tile_y", "sp", [-1, 2, 1, 3]], ["tile_k", "sp", [-1, 3, 1]]]}, "result": [[0.00514368565625], 0, 1.3406012058258057, 1629002087.8469198], "version": 0.2, "tvm_version": "0.8.dev0"}
{"input": ["cuda -keys=cuda,gpu -max_num_threads=1024 -model=unknown -thread_warp_size=32", "dense_large_batch.gpu", [["TENSOR", [512, 768], "float32"], ["TENSOR", [768, 768], "float32"], null, "float32"], {}], "config": {"index": 499456, "code_hash": null, "entity": [["tile_x", "sp", [-1, 2, 1, 2]], ["tile_y", "sp", [-1, 3, 1, 4]], ["tile_k", "sp", [-1, 4, 1]]]}, "result": [[0.004239087305555556], 0, 1.4209089279174805, 1629002088.7161613], "version": 0.2, "tvm_version": "0.8.dev0"}
{"input": ["cuda -keys=cuda,gpu -max_num_threads=1024 -model=unknown -thread_warp_size=32", "dense_large_batch.gpu", [["TENSOR", [512, 768], "float32"], ["TENSOR", [768, 768], "float32"], null, "float32"], {}], "config": {"index": 5018642, "code_hash": null, "entity": [["tile_x", "sp", [-1, 4, 1, 1]], ["tile_y", "sp", [-1, 1, 1, 6]], ["tile_k", "sp", [-1, 1, 3]]]}, "result": [[0.005159407625], 0, 1.2884082794189453, 1629002089.609013], "version": 0.2, "tvm_version": "0.8.dev0"}
{"input": ["cuda -keys=cuda,gpu -max_num_threads=1024 -model=unknown -thread_warp_size=32", "dense_large_batch.gpu", [["TENSOR", [512, 768], "float32"], ["TENSOR", [768, 768], "float32"], null, "float32"], {}], "config": {"index": 499402, "code_hash": null, "entity": [["tile_x", "sp", [-1, 4, 1, 1]], ["tile_y", "sp", [-1, 3, 1, 4]], ["tile_k", "sp", [-1, 4, 1]]]}, "result": [[0.004141410945945946], 0, 1.3394322395324707, 1629002091.7507887], "version": 0.2, "tvm_version": "0.8.dev0"}
{"input": ["cuda -keys=cuda,gpu -max_num_threads=1024 -model=unknown -thread_warp_size=32", "dense_large_batch.gpu", [["TENSOR", [512, 768], "float32"], ["TENSOR", [768, 768], "float32"], null, "float32"], {}], "config": {"index": 5026617, "code_hash": null, "entity": [["tile_x", "sp", [-1, 4, 1, 2]], ["tile_y", "sp", [-1, 1, 1, 8]], ["tile_k", "sp", [-1, 1, 3]]]}, "result": [[0.0029750466862745097], 0, 1.2810964584350586, 1629002092.583626], "version": 0.2, "tvm_version": "0.8.dev0"}
{"input": ["cuda -keys=cuda,gpu -max_num_threads=1024 -model=unknown -thread_warp_size=32", "dense_large_batch.gpu", [["TENSOR", [512, 768], "float32"], ["TENSOR", [768, 768], "float32"], null, "float32"], {}], "config": {"index": 372298, "code_hash": null, "entity": [["tile_x", "sp", [-1, 8, 1, 2]], ["tile_y", "sp", [-1, 1, 1, 6]], ["tile_k", "sp", [-1, 3, 1]]]}, "result": [[0.002971042137254902], 0, 1.4176764488220215, 1629002093.415079], "version": 0.2, "tvm_version": "0.8.dev0"}
{"input": ["cuda -keys=cuda,gpu -max_num_threads=1024 -model=unknown -thread_warp_size=32", "dense_large_batch.gpu", [["TENSOR", [512, 768], "float32"], ["TENSOR", [768, 768], "float32"], null, "float32"], {}], "config": {"index": 380163, "code_hash": null, "entity": [["tile_x", "sp", [-1, 8, 1, 1]], ["tile_y", "sp", [-1, 1, 1, 8]], ["tile_k", "sp", [-1, 3, 1]]]}, "result": [[0.0029611601960784317], 0, 1.3733341693878174, 1629002094.2499087], "version": 0.2, "tvm_version": "0.8.dev0"}
{"input": ["cuda -keys=cuda,gpu -max_num_threads=1024 -model=unknown -thread_warp_size=32", "dense_large_batch.gpu", [["TENSOR", [512, 768], "float32"], ["TENSOR", [768, 768], "float32"], null, "float32"], {}], "config": {"index": 248877, "code_hash": null, "entity": [["tile_x", "sp", [-1, 4, 1, 2]], ["tile_y", "sp", [-1, 1, 1, 12]], ["tile_k", "sp", [-1, 2, 1]]]}, "result": [[0.0031631975416666664], 0, 1.3718020915985107, 1629002095.09424], "version": 0.2, "tvm_version": "0.8.dev0"}
{"input": ["cuda -keys=cuda,gpu -max_num_threads=1024 -model=unknown -thread_warp_size=32", "dense_large_batch.gpu", [["TENSOR", [512, 768], "float32"], ["TENSOR", [768, 768], "float32"], null, "float32"], {}], "config": {"index": 2703362, "code_hash": null, "entity": [["tile_x", "sp", [-1, 4, 1, 1]], ["tile_y", "sp", [-1, 1, 1, 8]], ["tile_k", "sp", [-1, 1, 2]]]}, "result": [[0.0058563555], 0, 1.364746332168579, 1629002096.0834675], "version": 0.2, "tvm_version": "0.8.dev0"}
{"input": ["cuda -keys=cuda,gpu -max_num_threads=1024 -model=unknown -thread_warp_size=32", "dense_large_batch.gpu", [["TENSOR", [512, 768], "float32"], ["TENSOR", [768, 768], "float32"], null, "float32"], {}], "config": {"index": 227096, "code_hash": null, "entity": [["tile_x", "sp", [-1, 2, 1, 2]], ["tile_y", "sp", [-1, 1, 1, 6]], ["tile_k", "sp", [-1, 2, 1]]]}, "result": [[0.0054104035], 0, 1.3425078392028809, 1629002097.0058982], "version": 0.2, "tvm_version": "0.8.dev0"}
{"input": ["cuda -keys=cuda,gpu -max_num_threads=1024 -model=unknown -thread_warp_size=32", "dense_large_batch.gpu", [["TENSOR", [512, 768], "float32"], ["TENSOR", [768, 768], "float32"], null, "float32"], {}], "config": {"index": 344137, "code_hash": null, "entity": [["tile_x", "sp", [-1, 4, 1, 2]], ["tile_y", "sp", [-1, 2, 1, 3]], ["tile_k", "sp", [-1, 3, 1]]]}, "result": [[0.0037116682926829274], 0, 1.289996862411499, 1629002097.8322275], "version": 0.2, "tvm_version": "0.8.dev0"}
{"input": ["cuda -keys=cuda,gpu -max_num_threads=1024 -model=unknown -thread_warp_size=32", "dense_large_batch.gpu", [["TENSOR", [512, 768], "float32"], ["TENSOR", [768, 768], "float32"], null, "float32"], {}], "config": {"index": 380217, "code_hash": null, "entity": [["tile_x", "sp", [-1, 4, 1, 2]], ["tile_y", "sp", [-1, 1, 1, 8]], ["tile_k", "sp", [-1, 3, 1]]]}, "result": [[0.0029296394230769233], 0, 1.328573226928711, 1629002098.6721184], "version": 0.2, "tvm_version": "0.8.dev0"}
{"input": ["cuda -keys=cuda,gpu -max_num_threads=1024 -model=unknown -thread_warp_size=32", "dense_large_batch.gpu", [["TENSOR", [512, 768], "float32"], ["TENSOR", [768, 768], "float32"], null, "float32"], {}], "config": {"index": 2695717, "code_hash": null, "entity": [["tile_x", "sp", [-1, 4, 1, 2]], ["tile_y", "sp", [-1, 2, 1, 6]], ["tile_k", "sp", [-1, 1, 2]]]}, "result": [[0.0031711004166666665], 0, 1.3166897296905518, 1629002099.4980235], "version": 0.2, "tvm_version": "0.8.dev0"}
{"input": ["cuda -keys=cuda,gpu -max_num_threads=1024 -model=unknown -thread_warp_size=32", "dense_large_batch.gpu", [["TENSOR", [512, 768], "float32"], ["TENSOR", [768, 768], "float32"], null, "float32"], {}], "config": {"index": 5018862, "code_hash": null, "entity": [["tile_x", "sp", [-1, 4, 1, 1]], ["tile_y", "sp", [-1, 2, 1, 6]], ["tile_k", "sp", [-1, 1, 3]]]}, "result": [[0.003729890780487805], 0, 1.3379521369934082, 1629002100.329983], "version": 0.2, "tvm_version": "0.8.dev0"}
{"input": ["cuda -keys=cuda,gpu -max_num_threads=1024 -model=unknown -thread_warp_size=32", "dense_large_batch.gpu", [["TENSOR", [512, 768], "float32"], ["TENSOR", [768, 768], "float32"], null, "float32"], {}], "config": {"index": 5026782, "code_hash": null, "entity": [["tile_x", "sp", [-1, 4, 1, 1]], ["tile_y", "sp", [-1, 2, 1, 8]], ["tile_k", "sp", [-1, 1, 3]]]}, "result": [[0.003612448071428571], 0, 1.3378548622131348, 1629002101.1941347], "version": 0.2, "tvm_version": "0.8.dev0"}
{"input": ["cuda -keys=cuda,gpu -max_num_threads=1024 -model=unknown -thread_warp_size=32", "dense_large_batch.gpu", [["TENSOR", [512, 768], "float32"], ["TENSOR", [768, 768], "float32"], null, "float32"], {}], "config": {"index": 208881, "code_hash": null, "entity": [["tile_x", "sp", [-1, 2, 1, 4]], ["tile_y", "sp", [-1, 2, 1, 4]], ["tile_k", "sp", [-1, 2, 1]]]}, "result": [[0.0039057987435897443], 0, 1.2057929039001465, 1629002103.5509768], "version": 0.2, "tvm_version": "0.8.dev0"}
{"input": ["cuda -keys=cuda,gpu -max_num_threads=1024 -model=unknown -thread_warp_size=32", "dense_large_batch.gpu", [["TENSOR", [512, 768], "float32"], ["TENSOR", [768, 768], "float32"], null, "float32"], {}], "config": {"index": 6307457, "code_hash": null, "entity": [["tile_x", "sp", [-1, 4, 1, 2]], ["tile_y", "sp", [-1, 3, 1, 4]], ["tile_k", "sp", [-1, 1, 4]]]}, "result": [[0.0031170997662337665], 0, 1.8688418865203857, 1629002104.8128295], "version": 0.2, "tvm_version": "0.8.dev0"}
{"input": ["cuda -keys=cuda,gpu -max_num_threads=1024 -model=unknown -thread_warp_size=32", "dense_large_batch.gpu", [["TENSOR", [512, 768], "float32"], ["TENSOR", [768, 768], "float32"], null, "float32"], {}], "config": {"index": 2840917, "code_hash": null, "entity": [["tile_x", "sp", [-1, 4, 1, 2]], ["tile_y", "sp", [-1, 2, 1, 6]], ["tile_k", "sp", [-1, 2, 2]]]}, "result": [[0.0031288937346938776], 0, 1.530548334121704, 1629002105.6916037], "version": 0.2, "tvm_version": "0.8.dev0"}
{"input": ["cuda -keys=cuda,gpu -max_num_threads=1024 -model=unknown -thread_warp_size=32", "dense_large_batch.gpu", [["TENSOR", [512, 768], "float32"], ["TENSOR", [768, 768], "float32"], null, "float32"], {}], "config": {"index": 354203, "code_hash": null, "entity": [["tile_x", "sp", [-1, 8, 1, 1]], ["tile_y", "sp", [-1, 3, 1, 4]], ["tile_k", "sp", [-1, 3, 1]]]}, "result": [[0.0025764589830508475], 0, 1.4945011138916016, 1629002106.5389497], "version": 0.2, "tvm_version": "0.8.dev0"}
{"input": ["cuda -keys=cuda,gpu -max_num_threads=1024 -model=unknown -thread_warp_size=32", "dense_large_batch.gpu", [["TENSOR", [512, 768], "float32"], ["TENSOR", [768, 768], "float32"], null, "float32"], {}], "config": {"index": 344303, "code_hash": null, "entity": [["tile_x", "sp", [-1, 8, 1, 1]], ["tile_y", "sp", [-1, 4, 1, 3]], ["tile_k", "sp", [-1, 3, 1]]]}, "result": [[0.0026105294310344827], 0, 1.5424737930297852, 1629002107.3887198], "version": 0.2, "tvm_version": "0.8.dev0"}
{"input": ["cuda -keys=cuda,gpu -max_num_threads=1024 -model=unknown -thread_warp_size=32", "dense_large_batch.gpu", [["TENSOR", [512, 768], "float32"], ["TENSOR", [768, 768], "float32"], null, "float32"], {}], "config": {"index": 489503, "code_hash": null, "entity": [["tile_x", "sp", [-1, 8, 1, 1]], ["tile_y", "sp", [-1, 4, 1, 3]], ["tile_k", "sp", [-1, 4, 1]]]}, "result": [[0.003059114], 0, 2.1190226078033447, 1629002108.6845984], "version": 0.2, "tvm_version": "0.8.dev0"}
{"input": ["cuda -keys=cuda,gpu -max_num_threads=1024 -model=unknown -thread_warp_size=32", "dense_large_batch.gpu", [["TENSOR", [512, 768], "float32"], ["TENSOR", [768, 768], "float32"], null, "float32"], {}], "config": {"index": 499403, "code_hash": null, "entity": [["tile_x", "sp", [-1, 8, 1, 1]], ["tile_y", "sp", [-1, 3, 1, 4]], ["tile_k", "sp", [-1, 4, 1]]]}, "result": [[0.0030664374400000004], 0, 1.6454501152038574, 1629002109.556367], "version": 0.2, "tvm_version": "0.8.dev0"}
{"input": ["cuda -keys=cuda,gpu -max_num_threads=1024 -model=unknown -thread_warp_size=32", "dense_large_batch.gpu", [["TENSOR", [512, 768], "float32"], ["TENSOR", [768, 768], "float32"], null, "float32"], {}], "config": {"index": 372463, "code_hash": null, "entity": [["tile_x", "sp", [-1, 8, 1, 1]], ["tile_y", "sp", [-1, 2, 1, 6]], ["tile_k", "sp", [-1, 3, 1]]]}, "result": [[0.0025915386440677965], 0, 1.448979377746582, 1629002110.4022722], "version": 0.2, "tvm_version": "0.8.dev0"}
{"input": ["cuda -keys=cuda,gpu -max_num_threads=1024 -model=unknown -thread_warp_size=32", "dense_large_batch.gpu", [["TENSOR", [512, 768], "float32"], ["TENSOR", [768, 768], "float32"], null, "float32"], {}], "config": {"index": 499623, "code_hash": null, "entity": [["tile_x", "sp", [-1, 8, 1, 1]], ["tile_y", "sp", [-1, 4, 1, 4]], ["tile_k", "sp", [-1, 4, 1]]]}, "result": [[0.002503258319587629], 0, 2.1101369857788086, 1629002111.6944559], "version": 0.2, "tvm_version": "0.8.dev0"}
{"input": ["cuda -keys=cuda,gpu -max_num_threads=1024 -model=unknown -thread_warp_size=32", "dense_large_batch.gpu", [["TENSOR", [512, 768], "float32"], ["TENSOR", [768, 768], "float32"], null, "float32"], {}], "config": {"index": 354301, "code_hash": null, "entity": [["tile_x", "sp", [-1, 2, 1, 4]], ["tile_y", "sp", [-1, 3, 1, 4]], ["tile_k", "sp", [-1, 3, 1]]]}, "result": [[0.002617936], 0, 1.4918205738067627, 1629002112.5489209], "version": 0.2, "tvm_version": "0.8.dev0"}
{"input": ["cuda -keys=cuda,gpu -max_num_threads=1024 -model=unknown -thread_warp_size=32", "dense_large_batch.gpu", [["TENSOR", [512, 768], "float32"], ["TENSOR", [768, 768], "float32"], null, "float32"], {}], "config": {"index": 354520, "code_hash": null, "entity": [["tile_x", "sp", [-1, 1, 1, 4]], ["tile_y", "sp", [-1, 4, 1, 4]], ["tile_k", "sp", [-1, 3, 1]]]}, "result": [[0.0036035220476190477], 0, 1.3812930583953857, 1629002113.3804724], "version": 0.2, "tvm_version": "0.8.dev0"}
{"input": ["cuda -keys=cuda,gpu -max_num_threads=1024 -model=unknown -thread_warp_size=32", "dense_large_batch.gpu", [["TENSOR", [512, 768], "float32"], ["TENSOR", [768, 768], "float32"], null, "float32"], {}], "config": {"index": 344083, "code_hash": null, "entity": [["tile_x", "sp", [-1, 8, 1, 1]], ["tile_y", "sp", [-1, 2, 1, 3]], ["tile_k", "sp", [-1, 3, 1]]]}, "result": [[0.0037003301951219515], 0, 1.3538920879364014, 1629002114.2289069], "version": 0.2, "tvm_version": "0.8.dev0"}
{"input": ["cuda -keys=cuda,gpu -max_num_threads=1024 -model=unknown -thread_warp_size=32", "dense_large_batch.gpu", [["TENSOR", [512, 768], "float32"], ["TENSOR", [768, 768], "float32"], null, "float32"], {}], "config": {"index": 2677500, "code_hash": null, "entity": [["tile_x", "sp", [-1, 1, 1, 4]], ["tile_y", "sp", [-1, 3, 1, 4]], ["tile_k", "sp", [-1, 1, 2]]]}, "result": [[0.0042673350555555555], 0, 1.1299090385437012, 1629002115.6851618], "version": 0.2, "tvm_version": "0.8.dev0"}
{"input": ["cuda -keys=cuda,gpu -max_num_threads=1024 -model=unknown -thread_warp_size=32", "dense_large_batch.gpu", [["TENSOR", [512, 768], "float32"], ["TENSOR", [768, 768], "float32"], null, "float32"], {}], "config": {"index": 6347223, "code_hash": null, "entity": [["tile_x", "sp", [-1, 8, 1, 1]], ["tile_y", "sp", [-1, 1, 1, 12]], ["tile_k", "sp", [-1, 1, 4]]]}, "result": [[0.003034045256756757], 0, 1.8446946144104004, 1629002206.1492765], "version": 0.2, "tvm_version": "0.8.dev0"}
{"input": ["cuda -keys=cuda,gpu -max_num_threads=1024 -model=unknown -thread_warp_size=32", "dense_large_batch.gpu", [["TENSOR", [512, 768], "float32"], ["TENSOR", [768, 768], "float32"], null, "float32"], {}], "config": {"index": 372518, "code_hash": null, "entity": [["tile_x", "sp", [-1, 8, 1, 2]], ["tile_y", "sp", [-1, 2, 1, 6]], ["tile_k", "sp", [-1, 3, 1]]]}, "result": [[0.0024685259672131148], 0, 1.7865660190582275, 1629002207.0624814], "version": 0.2, "tvm_version": "0.8.dev0"}
{"input": ["cuda -keys=cuda,gpu -max_num_threads=1024 -model=unknown -thread_warp_size=32", "dense_large_batch.gpu", [["TENSOR", [512, 768], "float32"], ["TENSOR", [768, 768], "float32"], null, "float32"], {}], "config": {"index": 354038, "code_hash": null, "entity": [["tile_x", "sp", [-1, 8, 1, 2]], ["tile_y", "sp", [-1, 2, 1, 4]], ["tile_k", "sp", [-1, 3, 1]]]}, "result": [[0.0025037900833333334], 0, 1.4730803966522217, 1629002207.9219928], "version": 0.2, "tvm_version": "0.8.dev0"}
{"input": ["cuda -keys=cuda,gpu -max_num_threads=1024 -model=unknown -thread_warp_size=32", "dense_large_batch.gpu", [["TENSOR", [512, 768], "float32"], ["TENSOR", [768, 768], "float32"], null, "float32"], {}], "config": {"index": 354258, "code_hash": null, "entity": [["tile_x", "sp", [-1, 8, 1, 2]], ["tile_y", "sp", [-1, 3, 1, 4]], ["tile_k", "sp", [-1, 3, 1]]]}, "result": [[0.0022355799852941177], 0, 1.8923344612121582, 1629002208.8170233], "version": 0.2, "tvm_version": "0.8.dev0"}
{"input": ["cuda -keys=cuda,gpu -max_num_threads=1024 -model=unknown -thread_warp_size=32", "dense_large_batch.gpu", [["TENSOR", [512, 768], "float32"], ["TENSOR", [768, 768], "float32"], null, "float32"], {}], "config": {"index": 6347224, "code_hash": null, "entity": [["tile_x", "sp", [-1, 16, 1, 1]], ["tile_y", "sp", [-1, 1, 1, 12]], ["tile_k", "sp", [-1, 1, 4]]]}, "result": [[0.00589254853125], 0, 2.1420915126800537, 1629002209.8874843], "version": 0.2, "tvm_version": "0.8.dev0"}
{"input": ["cuda -keys=cuda,gpu -max_num_threads=1024 -model=unknown -thread_warp_size=32", "dense_large_batch.gpu", [["TENSOR", [512, 768], "float32"], ["TENSOR", [768, 768], "float32"], null, "float32"], {}], "config": {"index": 400184, "code_hash": null, "entity": [["tile_x", "sp", [-1, 16, 1, 1]], ["tile_y", "sp", [-1, 1, 1, 16]], ["tile_k", "sp", [-1, 3, 1]]]}, "result": [[0.0024399284838709677], 0, 1.8999271392822266, 1629002210.8176434], "version": 0.2, "tvm_version": "0.8.dev0"}
{"input": ["cuda -keys=cuda,gpu -max_num_threads=1024 -model=unknown -thread_warp_size=32", "dense_large_batch.gpu", [["TENSOR", [512, 768], "float32"], ["TENSOR", [768, 768], "float32"], null, "float32"], {}], "config": {"index": 5046584, "code_hash": null, "entity": [["tile_x", "sp", [-1, 16, 1, 1]], ["tile_y", "sp", [-1, 1, 1, 16]], ["tile_k", "sp", [-1, 1, 3]]]}, "result": [[0.00496985071875], 0, 2.0580263137817383, 1629002211.8239572], "version": 0.2, "tvm_version": "0.8.dev0"}
{"input": ["cuda -keys=cuda,gpu -max_num_threads=1024 -model=unknown -thread_warp_size=32", "dense_large_batch.gpu", [["TENSOR", [512, 768], "float32"], ["TENSOR", [768, 768], "float32"], null, "float32"], {}], "config": {"index": 5040424, "code_hash": null, "entity": [["tile_x", "sp", [-1, 16, 1, 1]], ["tile_y", "sp", [-1, 1, 1, 12]], ["tile_k", "sp", [-1, 1, 3]]]}, "result": [[0.004329064771428572], 0, 1.7491629123687744, 1629002212.749031], "version": 0.2, "tvm_version": "0.8.dev0"}
{"input": ["cuda -keys=cuda,gpu -max_num_threads=1024 -model=unknown -thread_warp_size=32", "dense_large_batch.gpu", [["TENSOR", [512, 768], "float32"], ["TENSOR", [768, 768], "float32"], null, "float32"], {}], "config": {"index": 394024, "code_hash": null, "entity": [["tile_x", "sp", [-1, 16, 1, 1]], ["tile_y", "sp", [-1, 1, 1, 12]], ["tile_k", "sp", [-1, 3, 1]]]}, "result": [[0.0022132059411764707], 0, 1.6756539344787598, 1629002213.6638436], "version": 0.2, "tvm_version": "0.8.dev0"}
{"input": ["cuda -keys=cuda,gpu -max_num_threads=1024 -model=unknown -thread_warp_size=32", "dense_large_batch.gpu", [["TENSOR", [512, 768], "float32"], ["TENSOR", [768, 768], "float32"], null, "float32"], {}], "config": {"index": 380218, "code_hash": null, "entity": [["tile_x", "sp", [-1, 8, 1, 2]], ["tile_y", "sp", [-1, 1, 1, 8]], ["tile_k", "sp", [-1, 3, 1]]]}, "result": [[0.002546406847457627], 0, 1.593358039855957, 1629002214.5177302], "version": 0.2, "tvm_version": "0.8.dev0"}
{"input": ["cuda -keys=cuda,gpu -max_num_threads=1024 -model=unknown -thread_warp_size=32", "dense_large_batch.gpu", [["TENSOR", [512, 768], "float32"], ["TENSOR", [768, 768], "float32"], null, "float32"], {}], "config": {"index": 545384, "code_hash": null, "entity": [["tile_x", "sp", [-1, 16, 1, 1]], ["tile_y", "sp", [-1, 1, 1, 16]], ["tile_k", "sp", [-1, 4, 1]]]}, "result": [[0.0029810560196078437], 0, 1.939199447631836, 1629002215.5481458], "version": 0.2, "tvm_version": "0.8.dev0"}
{"input": ["cuda -keys=cuda,gpu -max_num_threads=1024 -model=unknown -thread_warp_size=32", "dense_large_batch.gpu", [["TENSOR", [512, 768], "float32"], ["TENSOR", [768, 768], "float32"], null, "float32"], {}], "config": {"index": 394077, "code_hash": null, "entity": [["tile_x", "sp", [-1, 4, 1, 2]], ["tile_y", "sp", [-1, 1, 1, 12]], ["tile_k", "sp", [-1, 3, 1]]]}, "result": [[0.0027224828392857143], 0, 1.5280489921569824, 1629002216.414461], "version": 0.2, "tvm_version": "0.8.dev0"}
{"input": ["cuda -keys=cuda,gpu -max_num_threads=1024 -model=unknown -thread_warp_size=32", "dense_large_batch.gpu", [["TENSOR", [512, 768], "float32"], ["TENSOR", [768, 768], "float32"], null, "float32"], {}], "config": {"index": 6353384, "code_hash": null, "entity": [["tile_x", "sp", [-1, 16, 1, 1]], ["tile_y", "sp", [-1, 1, 1, 16]], ["tile_k", "sp", [-1, 1, 4]]]}, "result": [[0.006982841375], 0, 2.3273189067840576, 1629002219.3152082], "version": 0.2, "tvm_version": "0.8.dev0"}
{"input": ["cuda -keys=cuda,gpu -max_num_threads=1024 -model=unknown -thread_warp_size=32", "dense_large_batch.gpu", [["TENSOR", [512, 768], "float32"], ["TENSOR", [768, 768], "float32"], null, "float32"], {}], "config": {"index": 2862424, "code_hash": null, "entity": [["tile_x", "sp", [-1, 16, 1, 1]], ["tile_y", "sp", [-1, 1, 1, 12]], ["tile_k", "sp", [-1, 2, 2]]]}, "result": [[0.002286946272727273], 0, 1.991060733795166, 1629002220.2384775], "version": 0.2, "tvm_version": "0.8.dev0"}
{"input": ["cuda -keys=cuda,gpu -max_num_threads=1024 -model=unknown -thread_warp_size=32", "dense_large_batch.gpu", [["TENSOR", [512, 768], "float32"], ["TENSOR", [768, 768], "float32"], null, "float32"], {}], "config": {"index": 5040478, "code_hash": null, "entity": [["tile_x", "sp", [-1, 8, 1, 2]], ["tile_y", "sp", [-1, 1, 1, 12]], ["tile_k", "sp", [-1, 1, 3]]]}, "result": [[0.0022561791791044774], 0, 1.7167341709136963, 1629002221.1219277], "version": 0.2, "tvm_version": "0.8.dev0"}
{"input": ["cuda -keys=cuda,gpu -max_num_threads=1024 -model=unknown -thread_warp_size=32", "dense_large_batch.gpu", [["TENSOR", [512, 768], "float32"], ["TENSOR", [768, 768], "float32"], null, "float32"], {}], "config": {"index": 354302, "code_hash": null, "entity": [["tile_x", "sp", [-1, 4, 1, 4]], ["tile_y", "sp", [-1, 3, 1, 4]], ["tile_k", "sp", [-1, 3, 1]]]}, "result": [[0.0021878996231884055], 0, 1.867807388305664, 1629002222.0291696], "version": 0.2, "tvm_version": "0.8.dev0"}
{"input": ["cuda -keys=cuda,gpu -max_num_threads=1024 -model=unknown -thread_warp_size=32", "dense_large_batch.gpu", [["TENSOR", [512, 768], "float32"], ["TENSOR", [768, 768], "float32"], null, "float32"], {}], "config": {"index": 354522, "code_hash": null, "entity": [["tile_x", "sp", [-1, 4, 1, 4]], ["tile_y", "sp", [-1, 4, 1, 4]], ["tile_k", "sp", [-1, 3, 1]]]}, "result": [[0.0024379259175257733], 0, 2.388786792755127, 1629002223.382475], "version": 0.2, "tvm_version": "0.8.dev0"}
{"input": ["cuda -keys=cuda,gpu -max_num_threads=1024 -model=unknown -thread_warp_size=32", "dense_large_batch.gpu", [["TENSOR", [512, 768], "float32"], ["TENSOR", [768, 768], "float32"], null, "float32"], {}], "config": {"index": 5000658, "code_hash": null, "entity": [["tile_x", "sp", [-1, 8, 1, 2]], ["tile_y", "sp", [-1, 3, 1, 4]], ["tile_k", "sp", [-1, 1, 3]]]}, "result": [[0.002191568913043478], 0, 1.842609167098999, 1629002224.2816625], "version": 0.2, "tvm_version": "0.8.dev0"}
{"input": ["cuda -keys=cuda,gpu -max_num_threads=1024 -model=unknown -thread_warp_size=32", "dense_large_batch.gpu", [["TENSOR", [512, 768], "float32"], ["TENSOR", [768, 768], "float32"], null, "float32"], {}], "config": {"index": 354257, "code_hash": null, "entity": [["tile_x", "sp", [-1, 4, 1, 2]], ["tile_y", "sp", [-1, 3, 1, 4]], ["tile_k", "sp", [-1, 3, 1]]]}, "result": [[0.002696939270588235], 0, 1.911012887954712, 1629002225.531741], "version": 0.2, "tvm_version": "0.8.dev0"}
{"input": ["cuda -keys=cuda,gpu -max_num_threads=1024 -model=unknown -thread_warp_size=32", "dense_large_batch.gpu", [["TENSOR", [512, 768], "float32"], ["TENSOR", [768, 768], "float32"], null, "float32"], {}], "config": {"index": 344138, "code_hash": null, "entity": [["tile_x", "sp", [-1, 8, 1, 2]], ["tile_y", "sp", [-1, 2, 1, 3]], ["tile_k", "sp", [-1, 3, 1]]]}, "result": [[0.002964081862745098], 0, 1.565161943435669, 1629002226.388694], "version": 0.2, "tvm_version": "0.8.dev0"}
{"input": ["cuda -keys=cuda,gpu -max_num_threads=1024 -model=unknown -thread_warp_size=32", "dense_large_batch.gpu", [["TENSOR", [512, 768], "float32"], ["TENSOR", [768, 768], "float32"], null, "float32"], {}], "config": {"index": 5000657, "code_hash": null, "entity": [["tile_x", "sp", [-1, 4, 1, 2]], ["tile_y", "sp", [-1, 3, 1, 4]], ["tile_k", "sp", [-1, 1, 3]]]}, "result": [[0.0026931936249999996], 0, 1.5430924892425537, 1629002227.235535], "version": 0.2, "tvm_version": "0.8.dev0"}
{"input": ["cuda -keys=cuda,gpu -max_num_threads=1024 -model=unknown -thread_warp_size=32", "dense_large_batch.gpu", [["TENSOR", [512, 768], "float32"], ["TENSOR", [768, 768], "float32"], null, "float32"], {}], "config": {"index": 400237, "code_hash": null, "entity": [["tile_x", "sp", [-1, 4, 1, 2]], ["tile_y", "sp", [-1, 1, 1, 16]], ["tile_k", "sp", [-1, 3, 1]]]}, "result": [[0.0026050286896551725], 0, 1.6100225448608398, 1629002228.1010687], "version": 0.2, "tvm_version": "0.8.dev0"}
{"input": ["cuda -keys=cuda,gpu -max_num_threads=1024 -model=unknown -thread_warp_size=32", "dense_large_batch.gpu", [["TENSOR", [512, 768], "float32"], ["TENSOR", [768, 768], "float32"], null, "float32"], {}], "config": {"index": 6307623, "code_hash": null, "entity": [["tile_x", "sp", [-1, 8, 1, 1]], ["tile_y", "sp", [-1, 4, 1, 4]], ["tile_k", "sp", [-1, 1, 4]]]}, "result": [[0.0024963327213114754], 0, 1.6605243682861328, 1629002228.9573889], "version": 0.2, "tvm_version": "0.8.dev0"}
{"input": ["cuda -keys=cuda,gpu -max_num_threads=1024 -model=unknown -thread_warp_size=32", "dense_large_batch.gpu", [["TENSOR", [512, 768], "float32"], ["TENSOR", [768, 768], "float32"], null, "float32"], {}], "config": {"index": 354204, "code_hash": null, "entity": [["tile_x", "sp", [-1, 16, 1, 1]], ["tile_y", "sp", [-1, 3, 1, 4]], ["tile_k", "sp", [-1, 3, 1]]]}, "result": [[0.0022108141323529413], 0, 1.7018449306488037, 1629002229.8514907], "version": 0.2, "tvm_version": "0.8.dev0"}
{"input": ["cuda -keys=cuda,gpu -max_num_threads=1024 -model=unknown -thread_warp_size=32", "dense_large_batch.gpu", [["TENSOR", [512, 768], "float32"], ["TENSOR", [768, 768], "float32"], null, "float32"], {}], "config": {"index": 5040477, "code_hash": null, "entity": [["tile_x", "sp", [-1, 4, 1, 2]], ["tile_y", "sp", [-1, 1, 1, 12]], ["tile_k", "sp", [-1, 1, 3]]]}, "result": [[0.0027479687636363637], 0, 1.2615671157836914, 1629002232.3040369], "version": 0.2, "tvm_version": "0.8.dev0"}
{"input": ["cuda -keys=cuda,gpu -max_num_threads=1024 -model=unknown -thread_warp_size=32", "dense_large_batch.gpu", [["TENSOR", [512, 768], "float32"], ["TENSOR", [768, 768], "float32"], null, "float32"], {}], "config": {"index": 3007623, "code_hash": null, "entity": [["tile_x", "sp", [-1, 8, 1, 1]], ["tile_y", "sp", [-1, 1, 1, 12]], ["tile_k", "sp", [-1, 3, 2]]]}, "result": [[0.00542713925], 0, 1.590679407119751, 1629002233.2925193], "version": 0.2, "tvm_version": "0.8.dev0"}
{"input": ["cuda -keys=cuda,gpu -max_num_threads=1024 -model=unknown -thread_warp_size=32", "dense_large_batch.gpu", [["TENSOR", [512, 768], "float32"], ["TENSOR", [768, 768], "float32"], null, "float32"], {}], "config": {"index": 344401, "code_hash": null, "entity": [["tile_x", "sp", [-1, 2, 1, 4]], ["tile_y", "sp", [-1, 4, 1, 3]], ["tile_k", "sp", [-1, 3, 1]]]}, "result": [[0.0025837296101694916], 0, 1.3832542896270752, 1629002234.1511705], "version": 0.2, "tvm_version": "0.8.dev0"}
{"input": ["cuda -keys=cuda,gpu -max_num_threads=1024 -model=unknown -thread_warp_size=32", "dense_large_batch.gpu", [["TENSOR", [512, 768], "float32"], ["TENSOR", [768, 768], "float32"], null, "float32"], {}], "config": {"index": 344304, "code_hash": null, "entity": [["tile_x", "sp", [-1, 16, 1, 1]], ["tile_y", "sp", [-1, 4, 1, 3]], ["tile_k", "sp", [-1, 3, 1]]]}, "result": [[0.0022987955303030304], 0, 1.752204418182373, 1629002235.0609467], "version": 0.2, "tvm_version": "0.8.dev0"}
