transformer-cuda-autotuning.json
{"input": ["cuda -keys=cuda,gpu -max_num_threads=1024 -model=unknown -thread_warp_size=32", "dense_small_batch.gpu", [["TENSOR", [640, 512], "float32"], ["TENSOR", [1536, 512], "float32"], null, "float32"], {}], "config": {"index": 2, "code_hash": null, "entity": [["tile_k", "sp", [-1, 4]]]}, "result": [[0.00580338621875], 0, 1.2045564651489258, 1629032546.4920213], "version": 0.2, "tvm_version": "0.8.dev0"}
{"input": ["cuda -keys=cuda,gpu -max_num_threads=1024 -model=unknown -thread_warp_size=32", "dense_small_batch.gpu", [["TENSOR", [640, 512], "float32"], ["TENSOR", [1536, 512], "float32"], null, "float32"], {}], "config": {"index": 4, "code_hash": null, "entity": [["tile_k", "sp", [-1, 16]]]}, "result": [[0.001851029792682927], 0, 0.9397146701812744, 1629032547.2576303], "version": 0.2, "tvm_version": "0.8.dev0"}
{"input": ["cuda -keys=cuda,gpu -max_num_threads=1024 -model=unknown -thread_warp_size=32", "dense_small_batch.gpu", [["TENSOR", [640, 512], "float32"], ["TENSOR", [1536, 512], "float32"], null, "float32"], {}], "config": {"index": 8, "code_hash": null, "entity": [["tile_k", "sp", [-1, 256]]]}, "result": [[0.0034680303636363636], 0, 0.992699146270752, 1629032548.0697534], "version": 0.2, "tvm_version": "0.8.dev0"}
{"input": ["cuda -keys=cuda,gpu -max_num_threads=1024 -model=unknown -thread_warp_size=32", "dense_small_batch.gpu", [["TENSOR", [640, 512], "float32"], ["TENSOR", [1536, 512], "float32"], null, "float32"], {}], "config": {"index": 7, "code_hash": null, "entity": [["tile_k", "sp", [-1, 128]]]}, "result": [[0.001966730285714286], 0, 1.1208114624023438, 1629032548.8418875], "version": 0.2, "tvm_version": "0.8.dev0"}
{"input": ["cuda -keys=cuda,gpu -max_num_threads=1024 -model=unknown -thread_warp_size=32", "dense_small_batch.gpu", [["TENSOR", [640, 512], "float32"], ["TENSOR", [1536, 512], "float32"], null, "float32"], {}], "config": {"index": 1, "code_hash": null, "entity": [["tile_k", "sp", [-1, 2]]]}, "result": [[0.011111243699999999], 0, 1.2262697219848633, 1629032549.7961838], "version": 0.2, "tvm_version": "0.8.dev0"}
{"input": ["cuda -keys=cuda,gpu -max_num_threads=1024 -model=unknown -thread_warp_size=32", "dense_small_batch.gpu", [["TENSOR", [640, 512], "float32"], ["TENSOR", [1536, 512], "float32"], null, "float32"], {}], "config": {"index": 9, "code_hash": null, "entity": [["tile_k", "sp", [-1, 512]]]}, "result": [[0.00735897721875], 0, 1.4121742248535156, 1629032550.9192684], "version": 0.2, "tvm_version": "0.8.dev0"}
{"input": ["cuda -keys=cuda,gpu -max_num_threads=1024 -model=unknown -thread_warp_size=32", "dense_small_batch.gpu", [["TENSOR", [640, 512], "float32"], ["TENSOR", [1536, 512], "float32"], null, "float32"], {}], "config": {"index": 0, "code_hash": null, "entity": [["tile_k", "sp", [-1, 1]]]}, "result": [[0.02177111945], 0, 1.8840782642364502, 1629032552.518665], "version": 0.2, "tvm_version": "0.8.dev0"}
{"input": ["cuda -keys=cuda,gpu -max_num_threads=1024 -model=unknown -thread_warp_size=32", "dense_small_batch.gpu", [["TENSOR", [640, 512], "float32"], ["TENSOR", [1536, 512], "float32"], null, "float32"], {}], "config": {"index": 6, "code_hash": null, "entity": [["tile_k", "sp", [-1, 64]]]}, "result": [[0.001401677675925926], 0, 1.0625650882720947, 1629032553.265346], "version": 0.2, "tvm_version": "0.8.dev0"}
{"input": ["cuda -keys=cuda,gpu -max_num_threads=1024 -model=unknown -thread_warp_size=32", "dense_small_batch.gpu", [["TENSOR", [640, 512], "float32"], ["TENSOR", [1536, 512], "float32"], null, "float32"], {}], "config": {"index": 3, "code_hash": null, "entity": [["tile_k", "sp", [-1, 8]]]}, "result": [[0.003111457], 0, 1.0409064292907715, 1629032554.0496826], "version": 0.2, "tvm_version": "0.8.dev0"}
{"input": ["cuda -keys=cuda,gpu -max_num_threads=1024 -model=unknown -thread_warp_size=32", "dense_small_batch.gpu", [["TENSOR", [640, 512], "float32"], ["TENSOR", [1536, 512], "float32"], null, "float32"], {}], "config": {"index": 5, "code_hash": null, "entity": [["tile_k", "sp", [-1, 32]]]}, "result": [[0.0012736573109243697], 0, 0.9845366477966309, 1629032554.8056552], "version": 0.2, "tvm_version": "0.8.dev0"}
{"input": ["cuda -keys=cuda,gpu -max_num_threads=1024 -model=unknown -thread_warp_size=32", "dense_large_batch.gpu", [["TENSOR", [640, 512], "float32"], ["TENSOR", [1536, 512], "float32"], null, "float32"], {}], "config": {"index": 8352808, "code_hash": null, "entity": [["tile_x", "sp", [-1, 1, 16, 8]], ["tile_y", "sp", [-1, 3, 16, 16]], ["tile_k", "sp", [-1, 1, 4]]]}, "result": [[0.00526526784375], 0, 3.1350011825561523, 1629032581.3213344], "version": 0.2, "tvm_version": "0.8.dev0"}
{"input": ["cuda -keys=cuda,gpu -max_num_threads=1024 -model=unknown -thread_warp_size=32", "dense_large_batch.gpu", [["TENSOR", [640, 512], "float32"], ["TENSOR", [1536, 512], "float32"], null, "float32"], {}], "config": {"index": 9966261, "code_hash": null, "entity": [["tile_x", "sp", [-1, 10, 2, 1]], ["tile_y", "sp", [-1, 2, 2, 8]], ["tile_k", "sp", [-1, 16, 4]]]}, "result": [[0.0038354996749999995], 0, 8.21577763557434, 1629032584.1511588], "version": 0.2, "tvm_version": "0.8.dev0"}
{"input": ["cuda -keys=cuda,gpu -max_num_threads=1024 -model=unknown -thread_warp_size=32", "dense_large_batch.gpu", [["TENSOR", [640, 512], "float32"], ["TENSOR", [1536, 512], "float32"], null, "float32"], {}], "config": {"index": 5008160, "code_hash": null, "entity": [["tile_x", "sp", [-1, 1, 8, 8]], ["tile_y", "sp", [-1, 2, 8, 32]], ["tile_k", "sp", [-1, 2, 2]]]}, "result": [[0.0067908819375], 0, 2.4071297645568848, 1629032660.9484842], "version": 0.2, "tvm_version": "0.8.dev0"}
{"input": ["cuda -keys=cuda,gpu -max_num_threads=1024 -model=unknown -thread_warp_size=32", "dense_large_batch.gpu", [["TENSOR", [640, 512], "float32"], ["TENSOR", [1536, 512], "float32"], null, "float32"], {}], "config": {"index": 5008194, "code_hash": null, "entity": [["tile_x", "sp", [-1, 1, 8, 10]], ["tile_y", "sp", [-1, 2, 8, 32]], ["tile_k", "sp", [-1, 2, 2]]]}, "result": [[0.007363967093750001], 0, 2.467900514602661, 1629032662.2230303], "version": 0.2, "tvm_version": "0.8.dev0"}
{"input": ["cuda -keys=cuda,gpu -max_num_threads=1024 -model=unknown -thread_warp_size=32", "dense_large_batch.gpu", [["TENSOR", [640, 512], "float32"], ["TENSOR", [1536, 512], "float32"], null, "float32"], {}], "config": {"index": 17569565, "code_hash": null, "entity": [["tile_x", "sp", [-1, 5, 2, 2]], ["tile_y", "sp", [-1, 2, 2, 8]], ["tile_k", "sp", [-1, 2, 32]]]}, "result": [[0.008611413699999999], 0, 3.2968151569366455, 1629032666.7145717], "version": 0.2, "tvm_version": "0.8.dev0"}
{"input": ["cuda -keys=cuda,gpu -max_num_threads=1024 -model=unknown -thread_warp_size=32", "dense_large_batch.gpu", [["TENSOR", [640, 512], "float32"], ["TENSOR", [1536, 512], "float32"], null, "float32"], {}], "config": {"index": 8347520, "code_hash": null, "entity": [["tile_x", "sp", [-1, 1, 8, 8]], ["tile_y", "sp", [-1, 2, 8, 16]], ["tile_k", "sp", [-1, 1, 4]]]}, "result": [[0.00227940583], 0, 2.0390143394470215, 1629032748.9098716], "version": 0.2, "tvm_version": "0.8.dev0"}
{"input": ["cuda -keys=cuda,gpu -max_num_threads=1024 -model=unknown -thread_warp_size=32", "dense_large_batch.gpu", [["TENSOR", [640, 512], "float32"], ["TENSOR", [1536, 512], "float32"], null, "float32"], {}], "config": {"index": 8769440, "code_hash": null, "entity": [["tile_x", "sp", [-1, 1, 8, 8]], ["tile_y", "sp", [-1, 1, 8, 16]], ["tile_k", "sp", [-1, 2, 4]]]}, "result": [[0.0007898011649484537], 0, 1.5284454822540283, 1629032750.359919], "version": 0.2, "tvm_version": "0.8.dev0"}
{"input": ["cuda -keys=cuda,gpu -max_num_threads=1024 -model=unknown -thread_warp_size=32", "dense_large_batch.gpu", [["TENSOR", [640, 512], "float32"], ["TENSOR", [1536, 512], "float32"], null, "float32"], {}], "config": {"index": 4628989, "code_hash": null, "entity": [["tile_x", "sp", [-1, 1, 4, 10]], ["tile_y", "sp", [-1, 1, 4, 128]], ["tile_k", "sp", [-1, 1, 2]]]}, "result": [[0.022794543100000002], 0, 3.0405452251434326, 1629032754.87745], "version": 0.2, "tvm_version": "0.8.dev0"}
{"input": ["cuda -keys=cuda,gpu -max_num_threads=1024 -model=unknown -thread_warp_size=32", "dense_large_batch.gpu", [["TENSOR", [640, 512], "float32"], ["TENSOR", [1536, 512], "float32"], null, "float32"], {}], "config": {"index": 4564640, "code_hash": null, "entity": [["tile_x", "sp", [-1, 1, 8, 8]], ["tile_y", "sp", [-1, 1, 8, 24]], ["tile_k", "sp", [-1, 1, 2]]]}, "result": [[0.0007327796569579287], 0, 1.7231652736663818, 1629032759.0352526], "version": 0.2, "tvm_version": "0.8.dev0"}
{"input": ["cuda -keys=cuda,gpu -max_num_threads=1024 -model=unknown -thread_warp_size=32", "dense_large_batch.gpu", [["TENSOR", [640, 512], "float32"], ["TENSOR", [1536, 512], "float32"], null, "float32"], {}], "config": {"index": 17569460, "code_hash": null, "entity": [["tile_x", "sp", [-1, 8, 2, 1]], ["tile_y", "sp", [-1, 2, 2, 8]], ["tile_k", "sp", [-1, 2, 32]]]}, "result": [[0.0099995697], 0, 2.911386251449585, 1629032839.2237902], "version": 0.2, "tvm_version": "0.8.dev0"}
{"input": ["cuda -keys=cuda,gpu -max_num_threads=1024 -model=unknown -thread_warp_size=32", "dense_large_batch.gpu", [["TENSOR", [640, 512], "float32"], ["TENSOR", [1536, 512], "float32"], null, "float32"], {}], "config": {"index": 19259060, "code_hash": null, "entity": [["tile_x", "sp", [-1, 8, 2, 1]], ["tile_y", "sp", [-1, 2, 2, 8]], ["tile_k", "sp", [-1, 1, 64]]]}, "result": [[0.0100174567], 0, 1.9014875888824463, 1629032840.2495284], "version": 0.2, "tvm_version": "0.8.dev0"}
{"input": ["cuda -keys=cuda,gpu -max_num_threads=1024 -model=unknown -thread_warp_size=32", "dense_large_batch.gpu", [["TENSOR", [640, 512], "float32"], ["TENSOR", [1536, 512], "float32"], null, "float32"], {}], "config": {"index": 15457460, "code_hash": null, "entity": [["tile_x", "sp", [-1, 8, 2, 1]], ["tile_y", "sp", [-1, 2, 2, 8]], ["tile_k", "sp", [-1, 4, 16]]]}, "result": [[0.009607106899999999], 0, 6.823408603668213, 1629032841.604835], "version": 0.2, "tvm_version": "0.8.dev0"}
{"input": ["cuda -keys=cuda,gpu -max_num_threads=1024 -model=unknown -thread_warp_size=32", "dense_large_batch.gpu", [["TENSOR", [640, 512], "float32"], ["TENSOR", [1536, 512], "float32"], null, "float32"], {}], "config": {"index": 9965781, "code_hash": null, "entity": [["tile_x", "sp", [-1, 10, 2, 1]], ["tile_y", "sp", [-1, 1, 2, 8]], ["tile_k", "sp", [-1, 16, 4]]]}, "result": [[0.0015289221960784313], 0, 4.9706645011901855, 1629032843.0984693], "version": 0.2, "tvm_version": "0.8.dev0"}
{"input": ["cuda -keys=cuda,gpu -max_num_threads=1024 -model=unknown -thread_warp_size=32", "batch_matmul.cuda", [["TENSOR", [512, 20, 32], "float32"], ["TENSOR", [512, 20, 32], "float32"], [512, 20, 20]], {}], "config": {"index": 9183, "code_hash": null, "entity": [["tile_y", "sp", [-1, 5, 1]], ["tile_x", "sp", [-1, 1, 2]], ["tile_k", "sp", [-1, 16]], ["auto_unroll_max_step", "ot", 8], ["unroll_explicit", "ot", 1]]}, "result": [[8.507519497542327e-05], 0, 1.4175798892974854, 1629032847.4127557], "version": 0.2, "tvm_version": "0.8.dev0"}
{"input": ["cuda -keys=cuda,gpu -max_num_threads=1024 -model=unknown -thread_warp_size=32", "batch_matmul.cuda", [["TENSOR", [512, 20, 32], "float32"], ["TENSOR", [512, 20, 32], "float32"], [512, 20, 20]], {}], "config": {"index": 6704, "code_hash": null, "entity": [["tile_y", "sp", [-1, 5, 2]], ["tile_x", "sp", [-1, 1, 5]], ["tile_k", "sp", [-1, 4]], ["auto_unroll_max_step", "ot", 64], ["unroll_explicit", "ot", 0]]}, "result": [[3.85349933396765e-05], 0, 1.15989089012146, 1629032848.2525833], "version": 0.2, "tvm_version": "0.8.dev0"}
{"input": ["cuda -keys=cuda,gpu -max_num_threads=1024 -model=unknown -thread_warp_size=32", "batch_matmul.cuda", [["TENSOR", [512, 20, 32], "float32"], ["TENSOR", [512, 20, 32], "float32"], [512, 20, 20]], {}], "config": {"index": 7043, "code_hash": null, "entity": [["tile_y", "sp", [-1, 20, 1]], ["tile_x", "sp", [-1, 2, 5]], ["tile_k", "sp", [-1, 8]], ["auto_unroll_max_step", "ot", 64], ["unroll_explicit", "ot", 0]]}, "result": [[1.2697364768401015e-05], 0, 1.329730749130249, 1629032849.0607133], "version": 0.2, "tvm_version": "0.8.dev0"}
{"input": ["cuda -keys=cuda,gpu -max_num_threads=1024 -model=unknown -thread_warp_size=32", "batch_matmul.cuda", [["TENSOR", [512, 20, 32], "float32"], ["TENSOR", [512, 20, 32], "float32"], [512, 20, 20]], {}], "config": {"index": 8262, "code_hash": null, "entity": [["tile_y", "sp", [-1, 1, 1]], ["tile_x", "sp", [-1, 10, 2]], ["tile_k", "sp", [-1, 2]], ["auto_unroll_max_step", "ot", 8], ["unroll_explicit", "ot", 1]]}, "result": [[0.0001973281646778043], 0, 1.2955536842346191, 1629032849.905068], "version": 0.2, "tvm_version": "0.8.dev0"}
{"input": ["cuda -keys=cuda,gpu -max_num_threads=1024 -model=unknown -thread_warp_size=32", "batch_matmul.cuda", [["TENSOR", [512, 20, 32], "float32"], ["TENSOR", [512, 20, 32], "float32"], [512, 20, 20]], {}], "config": {"index": 10775, "code_hash": null, "entity": [["tile_y", "sp", [-1, 5, 4]], ["tile_x", "sp", [-1, 10, 1]], ["tile_k", "sp", [-1, 8]], ["auto_unroll_max_step", "ot", 16], ["unroll_explicit", "ot", 1]]}, "result": [[1.0896876659441885e-05], 0, 1.4184744358062744, 1629032850.7199798], "version": 0.2, "tvm_version": "0.8.dev0"}
{"input": ["cuda -keys=cuda,gpu -max_num_threads=1024 -model=unknown -thread_warp_size=32", "batch_matmul.cuda", [["TENSOR", [512, 20, 32], "float32"], ["TENSOR", [512, 20, 32], "float32"], [512, 20, 20]], {}], "config": {"index": 15197, "code_hash": null, "entity": [["tile_y", "sp", [-1, 20, 1]], ["tile_x", "sp", [-1, 2, 10]], ["tile_k", "sp", [-1, 16]], ["auto_unroll_max_step", "ot", 64], ["unroll_explicit", "ot", 1]]}, "result": [[1.0652458523184134e-05], 0, 1.4695515632629395, 1629032851.5377903], "version": 0.2, "tvm_version": "0.8.dev0"}
{"input": ["cuda -keys=cuda,gpu -max_num_threads=1024 -model=unknown -thread_warp_size=32", "batch_matmul.cuda", [["TENSOR", [512, 20, 32], "float32"], ["TENSOR", [512, 20, 32], "float32"], [512, 20, 20]], {}], "config": {"index": 4279, "code_hash": null, "entity": [["tile_y", "sp", [-1, 2, 5]], ["tile_x", "sp", [-1, 5, 1]], ["tile_k", "sp", [-1, 2]], ["auto_unroll_max_step", "ot", 32], ["unroll_explicit", "ot", 0]]}, "result": [[4.134747745490982e-05], 0, 1.3730900287628174, 1629032852.379388], "version": 0.2, "tvm_version": "0.8.dev0"}
{"input": ["cuda -keys=cuda,gpu -max_num_threads=1024 -model=unknown -thread_warp_size=32", "batch_matmul.cuda", [["TENSOR", [512, 20, 32], "float32"], ["TENSOR", [512, 20, 32], "float32"], [512, 20, 20]], {}], "config": {"index": 12095, "code_hash": null, "entity": [["tile_y", "sp", [-1, 1, 20]], ["tile_x", "sp", [-1, 20, 1]], ["tile_k", "sp", [-1, 2]], ["auto_unroll_max_step", "ot", 32], ["unroll_explicit", "ot", 1]]}, "result": [[2.2726021893738666e-05], 0, 1.3719170093536377, 1629032853.2089438], "version": 0.2, "tvm_version": "0.8.dev0"}
{"input": ["cuda -keys=cuda,gpu -max_num_threads=1024 -model=unknown -thread_warp_size=32", "batch_matmul.cuda", [["TENSOR", [512, 20, 32], "float32"], ["TENSOR", [512, 20, 32], "float32"], [512, 20, 20]], {}], "config": {"index": 1940, "code_hash": null, "entity": [["tile_y", "sp", [-1, 4, 5]], ["tile_x", "sp", [-1, 1, 20]], ["tile_k", "sp", [-1, 32]], ["auto_unroll_max_step", "ot", 8], ["unroll_explicit", "ot", 0]]}, "result": [[2.6412416800772448e-05], 0, 1.5582630634307861, 1629032854.0391798], "version": 0.2, "tvm_version": "0.8.dev0"}
{"input": ["cuda -keys=cuda,gpu -max_num_threads=1024 -model=unknown -thread_warp_size=32", "batch_matmul.cuda", [["TENSOR", [512, 20, 32], "float32"], ["TENSOR", [512, 20, 32], "float32"], [512, 20, 20]], {}], "config": {"index": 11320, "code_hash": null, "entity": [["tile_y", "sp", [-1, 2, 10]], ["tile_x", "sp", [-1, 2, 10]], ["tile_k", "sp", [-1, 16]], ["auto_unroll_max_step", "ot", 16], ["unroll_explicit", "ot", 1]]}, "result": [[2.0490706851037082e-05], 0, 1.4857409000396729, 1629032854.8886766], "version": 0.2, "tvm_version": "0.8.dev0"}
{"input": ["cuda -keys=cuda,gpu -max_num_threads=1024 -model=unknown -thread_warp_size=32", "batch_matmul.cuda", [["TENSOR", [512, 20, 32], "float32"], ["TENSOR", [512, 20, 32], "float32"], [512, 20, 20]], {}], "config": {"index": 727, "code_hash": null, "entity": [["tile_y", "sp", [-1, 2, 2]], ["tile_x", "sp", [-1, 10, 1]], ["tile_k", "sp", [-1, 4]], ["auto_unroll_max_step", "ot", 8], ["unroll_explicit", "ot", 0]]}, "result": [[2.2970389870273254e-05], 0, 1.3545737266540527, 1629032855.736872], "version": 0.2, "tvm_version": "0.8.dev0"}
{"input": ["cuda -keys=cuda,gpu -max_num_threads=1024 -model=unknown -thread_warp_size=32", "batch_matmul.cuda", [["TENSOR", [512, 20, 32], "float32"], ["TENSOR", [512, 20, 32], "float32"], [512, 20, 20]], {}], "config": {"index": 5720, "code_hash": null, "entity": [["tile_y", "sp", [-1, 4, 5]], ["tile_x", "sp", [-1, 5, 4]], ["tile_k", "sp", [-1, 32]], ["auto_unroll_max_step", "ot", 32], ["unroll_explicit", "ot", 0]]}, "result": [[1.5418182621779197e-05], 0, 1.2353737354278564, 1629032856.5700154], "version": 0.2, "tvm_version": "0.8.dev0"}
{"input": ["cuda -keys=cuda,gpu -max_num_threads=1024 -model=unknown -thread_warp_size=32", "batch_matmul.cuda", [["TENSOR", [512, 20, 32], "float32"], ["TENSOR", [512, 20, 32], "float32"], [512, 20, 20]], {}], "config": {"index": 4141, "code_hash": null, "entity": [["tile_y", "sp", [-1, 2, 1]], ["tile_x", "sp", [-1, 4, 5]], ["tile_k", "sp", [-1, 1]], ["auto_unroll_max_step", "ot", 32], ["unroll_explicit", "ot", 0]]}, "result": [[0.00012334127329545456], 0, 1.3884224891662598, 1629032859.2745628], "version": 0.2, "tvm_version": "0.8.dev0"}
{"input": ["cuda -keys=cuda,gpu -max_num_threads=1024 -model=unknown -thread_warp_size=32", "batch_matmul.cuda", [["TENSOR", [512, 20, 32], "float32"], ["TENSOR", [512, 20, 32], "float32"], [512, 20, 20]], {}], "config": {"index": 9763, "code_hash": null, "entity": [["tile_y", "sp", [-1, 2, 2]], ["tile_x", "sp", [-1, 4, 1]], ["tile_k", "sp", [-1, 1]], ["auto_unroll_max_step", "ot", 16], ["unroll_explicit", "ot", 1]]}, "result": [[0.00012665365801526717], 0, 1.1943297386169434, 1629032860.1242929], "version": 0.2, "tvm_version": "0.8.dev0"}
{"input": ["cuda -keys=cuda,gpu -max_num_threads=1024 -model=unknown -thread_warp_size=32", "batch_matmul.cuda", [["TENSOR", [512, 20, 32], "float32"], ["TENSOR", [512, 20, 32], "float32"], [512, 20, 20]], {}], "config": {"index": 13640, "code_hash": null, "entity": [["tile_y", "sp", [-1, 4, 5]], ["tile_x", "sp", [-1, 2, 1]], ["tile_k", "sp", [-1, 1]], ["auto_unroll_max_step", "ot", 64], ["unroll_explicit", "ot", 1]]}, "result": [[9.698082485549132e-05], 0, 1.3551559448242188, 1629032860.9778929], "version": 0.2, "tvm_version": "0.8.dev0"}
{"input": ["cuda -keys=cuda,gpu -max_num_threads=1024 -model=unknown -thread_warp_size=32", "batch_matmul.cuda", [["TENSOR", [512, 20, 32], "float32"], ["TENSOR", [512, 20, 32], "float32"], [512, 20, 20]], {}], "config": {"index": 9166, "code_hash": null, "entity": [["tile_y", "sp", [-1, 10, 1]], ["tile_x", "sp", [-1, 20, 1]], ["tile_k", "sp", [-1, 16]], ["auto_unroll_max_step", "ot", 8], ["unroll_explicit", "ot", 1]]}, "result": [[1.6198922886311825e-05], 0, 1.401643991470337, 1629032861.8038619], "version": 0.2, "tvm_version": "0.8.dev0"}
{"input": ["cuda -keys=cuda,gpu -max_num_threads=1024 -model=unknown -thread_warp_size=32", "batch_matmul.cuda", [["TENSOR", [512, 20, 32], "float32"], ["TENSOR", [512, 20, 32], "float32"], [512, 20, 20]], {}], "config": {"index": 5282, "code_hash": null, "entity": [["tile_y", "sp", [-1, 5, 2]], ["tile_x", "sp", [-1, 20, 1]], ["tile_k", "sp", [-1, 16]], ["auto_unroll_max_step", "ot", 32], ["unroll_explicit", "ot", 0]]}, "result": [[1.2135029850746268e-05], 0, 1.3331654071807861, 1629032862.6366613], "version": 0.2, "tvm_version": "0.8.dev0"}
{"input": ["cuda -keys=cuda,gpu -max_num_threads=1024 -model=unknown -thread_warp_size=32", "batch_matmul.cuda", [["TENSOR", [512, 20, 32], "float32"], ["TENSOR", [512, 20, 32], "float32"], [512, 20, 20]], {}], "config": {"index": 8539, "code_hash": null, "entity": [["tile_y", "sp", [-1, 2, 2]], ["tile_x", "sp", [-1, 1, 2]], ["tile_k", "sp", [-1, 4]], ["auto_unroll_max_step", "ot", 8], ["unroll_explicit", "ot", 1]]}, "result": [[0.0001203507577060932], 0, 1.4706993103027344, 1629032863.4821122], "version": 0.2, "tvm_version": "0.8.dev0"}
{"input": ["cuda -keys=cuda,gpu -max_num_threads=1024 -model=unknown -thread_warp_size=32", "batch_matmul.cuda", [["TENSOR", [512, 20, 32], "float32"], ["TENSOR", [512, 20, 32], "float32"], [512, 20, 20]], {}], "config": {"index": 6260, "code_hash": null, "entity": [["tile_y", "sp", [-1, 4, 5]], ["tile_x", "sp", [-1, 20, 1]], ["tile_k", "sp", [-1, 2]], ["auto_unroll_max_step", "ot", 64], ["unroll_explicit", "ot", 0]]}, "result": [[1.536445645419452e-05], 0, 1.3769102096557617, 1629032864.297032], "version": 0.2, "tvm_version": "0.8.dev0"}
{"input": ["cuda -keys=cuda,gpu -max_num_threads=1024 -model=unknown -thread_warp_size=32", "batch_matmul.cuda", [["TENSOR", [512, 20, 32], "float32"], ["TENSOR", [512, 20, 32], "float32"], [512, 20, 20]], {}], "config": {"index": 14631, "code_hash": null, "entity": [["tile_y", "sp", [-1, 1, 10]], ["tile_x", "sp", [-1, 4, 1]], ["tile_k", "sp", [-1, 8]], ["auto_unroll_max_step", "ot", 64], ["unroll_explicit", "ot", 1]]}, "result": [[3.897094440551273e-05], 0, 1.4360849857330322, 1629032865.1465063], "version": 0.2, "tvm_version": "0.8.dev0"}
{"input": ["cuda -keys=cuda,gpu -max_num_threads=1024 -model=unknown -thread_warp_size=32", "batch_matmul.cuda", [["TENSOR", [512, 20, 32], "float32"], ["TENSOR", [512, 20, 32], "float32"], [512, 20, 20]], {}], "config": {"index": 12276, "code_hash": null, "entity": [["tile_y", "sp", [-1, 1, 1]], ["tile_x", "sp", [-1, 2, 10]], ["tile_k", "sp", [-1, 2]], ["auto_unroll_max_step", "ot", 32], ["unroll_explicit", "ot", 1]]}, "result": [[0.00026341835473340586], 0, 1.6696138381958008, 1629032866.2776773], "version": 0.2, "tvm_version": "0.8.dev0"}
{"input": ["cuda -keys=cuda,gpu -max_num_threads=1024 -model=unknown -thread_warp_size=32", "batch_matmul.cuda", [["TENSOR", [512, 20, 32], "float32"], ["TENSOR", [512, 20, 32], "float32"], [512, 20, 20]], {}], "config": {"index": 1874, "code_hash": null, "entity": [["tile_y", "sp", [-1, 4, 1]], ["tile_x", "sp", [-1, 4, 5]], ["tile_k", "sp", [-1, 32]], ["auto_unroll_max_step", "ot", 8], ["unroll_explicit", "ot", 0]]}, "result": [[2.2041124059139783e-05], 0, 1.4603357315063477, 1629032867.1153905], "version": 0.2, "tvm_version": "0.8.dev0"}
{"input": ["cuda -keys=cuda,gpu -max_num_threads=1024 -model=unknown -thread_warp_size=32", "batch_matmul.cuda", [["TENSOR", [512, 20, 32], "float32"], ["TENSOR", [512, 20, 32], "float32"], [512, 20, 20]], {}], "config": {"index": 9032, "code_hash": null, "entity": [["tile_y", "sp", [-1, 4, 5]], ["tile_x", "sp", [-1, 1, 10]], ["tile_k", "sp", [-1, 8]], ["auto_unroll_max_step", "ot", 8], ["unroll_explicit", "ot", 1]]}, "result": [[2.3210719712959053e-05], 0, 1.3839287757873535, 1629032868.001992], "version": 0.2, "tvm_version": "0.8.dev0"}
{"input": ["cuda -keys=cuda,gpu -max_num_threads=1024 -model=unknown -thread_warp_size=32", "batch_matmul.cuda", [["TENSOR", [512, 20, 32], "float32"], ["TENSOR", [512, 20, 32], "float32"], [512, 20, 20]], {}], "config": {"index": 715, "code_hash": null, "entity": [["tile_y", "sp", [-1, 2, 5]], ["tile_x", "sp", [-1, 5, 1]], ["tile_k", "sp", [-1, 4]], ["auto_unroll_max_step", "ot", 8], ["unroll_explicit", "ot", 0]]}, "result": [[2.2896961242479364e-05], 0, 1.2350008487701416, 1629032868.833905], "version": 0.2, "tvm_version": "0.8.dev0"}
{"input": ["cuda -keys=cuda,gpu -max_num_threads=1024 -model=unknown -thread_warp_size=32", "batch_matmul.cuda", [["TENSOR", [512, 20, 32], "float32"], ["TENSOR", [512, 20, 32], "float32"], [512, 20, 20]], {}], "config": {"index": 9497, "code_hash": null, "entity": [["tile_y", "sp", [-1, 5, 4]], ["tile_x", "sp", [-1, 20, 1]], ["tile_k", "sp", [-1, 32]], ["auto_unroll_max_step", "ot", 8], ["unroll_explicit", "ot", 1]]}, "result": [[1.0479792995295349e-05], 0, 1.0630669593811035, 1629032871.257567], "version": 0.2, "tvm_version": "0.8.dev0"}
{"input": ["cuda -keys=cuda,gpu -max_num_threads=1024 -model=unknown -thread_warp_size=32", "batch_matmul.cuda", [["TENSOR", [512, 20, 32], "float32"], ["TENSOR", [512, 20, 32], "float32"], [512, 20, 20]], {}], "config": {"index": 12145, "code_hash": null, "entity": [["tile_y", "sp", [-1, 2, 5]], ["tile_x", "sp", [-1, 5, 2]], ["tile_k", "sp", [-1, 2]], ["auto_unroll_max_step", "ot", 32], ["unroll_explicit", "ot", 1]]}, "result": [[2.5970545225735407e-05], 0, 1.1160473823547363, 1629032872.1039357], "version": 0.2, "tvm_version": "0.8.dev0"}
{"input": ["cuda -keys=cuda,gpu -max_num_threads=1024 -model=unknown -thread_warp_size=32", "batch_matmul.cuda", [["TENSOR", [512, 20, 32], "float32"], ["TENSOR", [512, 20, 32], "float32"], [512, 20, 20]], {}], "config": {"index": 13708, "code_hash": null, "entity": [["tile_y", "sp", [-1, 1, 4]], ["tile_x", "sp", [-1, 20, 1]], ["tile_k", "sp", [-1, 1]], ["auto_unroll_max_step", "ot", 64], ["unroll_explicit", "ot", 1]]}, "result": [[0.00011147745689655172], 0, 1.263115644454956, 1629032872.9577787], "version": 0.2, "tvm_version": "0.8.dev0"}
{"input": ["cuda -keys=cuda,gpu -max_num_threads=1024 -model=unknown -thread_warp_size=32", "batch_matmul.cuda", [["TENSOR", [512, 20, 32], "float32"], ["TENSOR", [512, 20, 32], "float32"], [512, 20, 20]], {}], "config": {"index": 4050, "code_hash": null, "entity": [["tile_y", "sp", [-1, 1, 1]], ["tile_x", "sp", [-1, 10, 2]], ["tile_k", "sp", [-1, 1]], ["auto_unroll_max_step", "ot", 32], ["unroll_explicit", "ot", 0]]}, "result": [[0.0003733082877583466], 0, 1.6873371601104736, 1629032874.1238697], "version": 0.2, "tvm_version": "0.8.dev0"}
{"input": ["cuda -keys=cuda,gpu -max_num_threads=1024 -model=unknown -thread_warp_size=32", "batch_matmul.cuda", [["TENSOR", [512, 20, 32], "float32"], ["TENSOR", [512, 20, 32], "float32"], [512, 20, 20]], {}], "config": {"index": 14705, "code_hash": null, "entity": [["tile_y", "sp", [-1, 1, 20]], ["tile_x", "sp", [-1, 1, 2]], ["tile_k", "sp", [-1, 8]], ["auto_unroll_max_step", "ot", 64], ["unroll_explicit", "ot", 1]]}, "result": [[0.00014760141076233183], 0, 1.5744662284851074, 1629032875.0354147], "version": 0.2, "tvm_version": "0.8.dev0"}
{"input": ["cuda -keys=cuda,gpu -max_num_threads=1024 -model=unknown -thread_warp_size=32", "batch_matmul.cuda", [["TENSOR", [512, 20, 32], "float32"], ["TENSOR", [512, 20, 32], "float32"], [512, 20, 20]], {}], "config": {"index": 5030, "code_hash": null, "entity": [["tile_y", "sp", [-1, 5, 2]], ["tile_x", "sp", [-1, 10, 2]], ["tile_k", "sp", [-1, 8]], ["auto_unroll_max_step", "ot", 32], ["unroll_explicit", "ot", 0]]}, "result": [[1.2406717751937986e-05], 0, 1.3921048641204834, 1629032875.8400185], "version": 0.2, "tvm_version": "0.8.dev0"}
{"input": ["cuda -keys=cuda,gpu -max_num_threads=1024 -model=unknown -thread_warp_size=32", "batch_matmul.cuda", [["TENSOR", [512, 20, 32], "float32"], ["TENSOR", [512, 20, 32], "float32"], [512, 20, 20]], {}], "config": {"index": 2795, "code_hash": null, "entity": [["tile_y", "sp", [-1, 20, 1]], ["tile_x", "sp", [-1, 5, 4]], ["tile_k", "sp", [-1, 4]], ["auto_unroll_max_step", "ot", 16], ["unroll_explicit", "ot", 0]]}, "result": [[1.5069530265680636e-05], 0, 1.3570175170898438, 1629032876.6714118], "version": 0.2, "tvm_version": "0.8.dev0"}
{"input": ["cuda -keys=cuda,gpu -max_num_threads=1024 -model=unknown -thread_warp_size=32", "batch_matmul.cuda", [["TENSOR", [512, 20, 32], "float32"], ["TENSOR", [512, 20, 32], "float32"], [512, 20, 20]], {}], "config": {"index": 6836, "code_hash": null, "entity": [["tile_y", "sp", [-1, 4, 5]], ["tile_x", "sp", [-1, 2, 1]], ["tile_k", "sp", [-1, 8]], ["auto_unroll_max_step", "ot", 64], ["unroll_explicit", "ot", 0]]}, "result": [[3.269475267750893e-05], 0, 1.3851642608642578, 1629032877.5138052], "version": 0.2, "tvm_version": "0.8.dev0"}
{"input": ["cuda -keys=cuda,gpu -max_num_threads=1024 -model=unknown -thread_warp_size=32", "batch_matmul.cuda", [["TENSOR", [512, 20, 32], "float32"], ["TENSOR", [512, 20, 32], "float32"], [512, 20, 20]], {}], "config": {"index": 11082, "code_hash": null, "entity": [["tile_y", "sp", [-1, 1, 5]], ["tile_x", "sp", [-1, 5, 1]], ["tile_k", "sp", [-1, 16]], ["auto_unroll_max_step", "ot", 16], ["unroll_explicit", "ot", 1]]}, "result": [[3.509736323060574e-05], 0, 1.4644067287445068, 1629032878.366515], "version": 0.2, "tvm_version": "0.8.dev0"}
{"input": ["cuda -keys=cuda,gpu -max_num_threads=1024 -model=unknown -thread_warp_size=32", "batch_matmul.cuda", [["TENSOR", [512, 20, 32], "float32"], ["TENSOR", [512, 20, 32], "float32"], [512, 20, 20]], {}], "config": {"index": 1668, "code_hash": null, "entity": [["tile_y", "sp", [-1, 1, 5]], ["tile_x", "sp", [-1, 4, 1]], ["tile_k", "sp", [-1, 32]], ["auto_unroll_max_step", "ot", 8], ["unroll_explicit", "ot", 0]]}, "result": [[4.054819831325301e-05], 0, 1.3133721351623535, 1629032879.2160537], "version": 0.2, "tvm_version": "0.8.dev0"}
{"input": ["cuda -keys=cuda,gpu -max_num_threads=1024 -model=unknown -thread_warp_size=32", "batch_matmul.cuda", [["TENSOR", [512, 20, 32], "float32"], ["TENSOR", [512, 20, 32], "float32"], [512, 20, 20]], {}], "config": {"index": 11342, "code_hash": null, "entity": [["tile_y", "sp", [-1, 4, 1]], ["tile_x", "sp", [-1, 1, 1]], ["tile_k", "sp", [-1, 32]], ["auto_unroll_max_step", "ot", 16], ["unroll_explicit", "ot", 1]]}, "result": [[0.00015801229992992293], 0, 1.6187314987182617, 1629032880.3717644], "version": 0.2, "tvm_version": "0.8.dev0"}
{"input": ["cuda -keys=cuda,gpu -max_num_threads=1024 -model=unknown -thread_warp_size=32", "batch_matmul.cuda", [["TENSOR", [512, 20, 32], "float32"], ["TENSOR", [512, 20, 32], "float32"], [512, 20, 20]], {}], "config": {"index": 14289, "code_hash": null, "entity": [["tile_y", "sp", [-1, 1, 10]], ["tile_x", "sp", [-1, 2, 1]], ["tile_k", "sp", [-1, 4]], ["auto_unroll_max_step", "ot", 64], ["unroll_explicit", "ot", 1]]}, "result": [[0.00010734403428201811], 0, 1.2899343967437744, 1629032881.2249846], "version": 0.2, "tvm_version": "0.8.dev0"}
{"input": ["cuda -keys=cuda,gpu -max_num_threads=1024 -model=unknown -thread_warp_size=32", "batch_matmul.cuda", [["TENSOR", [512, 20, 32], "float32"], ["TENSOR", [512, 20, 32], "float32"], [512, 20, 20]], {}], "config": {"index": 7558, "code_hash": null, "entity": [["tile_y", "sp", [-1, 2, 10]], ["tile_x", "sp", [-1, 20, 1]], ["tile_k", "sp", [-1, 32]], ["auto_unroll_max_step", "ot", 64], ["unroll_explicit", "ot", 0]]}, "result": [[8.138744507604856e-06], 0, 1.1692264080047607, 1629032883.6042886], "version": 0.2, "tvm_version": "0.8.dev0"}
{"input": ["cuda -keys=cuda,gpu -max_num_threads=1024 -model=unknown -thread_warp_size=32", "batch_matmul.cuda", [["TENSOR", [512, 20, 32], "float32"], ["TENSOR", [512, 20, 32], "float32"], [512, 20, 20]], {}], "config": {"index": 525, "code_hash": null, "entity": [["tile_y", "sp", [-1, 5, 1]], ["tile_x", "sp", [-1, 5, 4]], ["tile_k", "sp", [-1, 2]], ["auto_unroll_max_step", "ot", 8], ["unroll_explicit", "ot", 0]]}, "result": [[2.7648886237607125e-05], 0, 1.2333853244781494, 1629032884.4148319], "version": 0.2, "tvm_version": "0.8.dev0"}
{"input": ["cuda -keys=cuda,gpu -max_num_threads=1024 -model=unknown -thread_warp_size=32", "batch_matmul.cuda", [["TENSOR", [512, 20, 32], "float32"], ["TENSOR", [512, 20, 32], "float32"], [512, 20, 20]], {}], "config": {"index": 6990, "code_hash": null, "entity": [["tile_y", "sp", [-1, 1, 2]], ["tile_x", "sp", [-1, 1, 4]], ["tile_k", "sp", [-1, 8]], ["auto_unroll_max_step", "ot", 64], ["unroll_explicit", "ot", 0]]}, "result": [[0.00020121492247301276], 0, 1.5085654258728027, 1629032885.5141702], "version": 0.2, "tvm_version": "0.8.dev0"}
{"input": ["cuda -keys=cuda,gpu -max_num_threads=1024 -model=unknown -thread_warp_size=32", "batch_matmul.cuda", [["TENSOR", [512, 20, 32], "float32"], ["TENSOR", [512, 20, 32], "float32"], [512, 20, 20]], {}], "config": {"index": 7409, "code_hash": null, "entity": [["tile_y", "sp", [-1, 5, 4]], ["tile_x", "sp", [-1, 1, 10]], ["tile_k", "sp", [-1, 16]], ["auto_unroll_max_step", "ot", 64], ["unroll_explicit", "ot", 0]]}, "result": [[2.4658966053108026e-05], 0, 1.4306387901306152, 1629032886.3910382], "version": 0.2, "tvm_version": "0.8.dev0"}
{"input": ["cuda -keys=cuda,gpu -max_num_threads=1024 -model=unknown -thread_warp_size=32", "batch_matmul.cuda", [["TENSOR", [512, 20, 32], "float32"], ["TENSOR", [512, 20, 32], "float32"], [512, 20, 20]], {}], "config": {"index": 8329, "code_hash": null, "entity": [["tile_y", "sp", [-1, 2, 5]], ["tile_x", "sp", [-1, 1, 5]], ["tile_k", "sp", [-1, 2]], ["auto_unroll_max_step", "ot", 8], ["unroll_explicit", "ot", 1]]}, "result": [[6.144140644683216e-05], 0, 1.5244097709655762, 1629032887.234069], "version": 0.2, "tvm_version": "0.8.dev0"}
{"input": ["cuda -keys=cuda,gpu -max_num_threads=1024 -model=unknown -thread_warp_size=32", "batch_matmul.cuda", [["TENSOR", [512, 20, 32], "float32"], ["TENSOR", [512, 20, 32], "float32"], [512, 20, 20]], {}], "config": {"index": 14528, "code_hash": null, "entity": [["tile_y", "sp", [-1, 4, 1]], ["tile_x", "sp", [-1, 1, 10]], ["tile_k", "sp", [-1, 4]], ["auto_unroll_max_step", "ot", 64], ["unroll_explicit", "ot", 1]]}, "result": [[4.5933723055555556e-05], 0, 1.3982255458831787, 1629032888.079982], "version": 0.2, "tvm_version": "0.8.dev0"}
{"input": ["cuda -keys=cuda,gpu -max_num_threads=1024 -model=unknown -thread_warp_size=32", "batch_matmul.cuda", [["TENSOR", [512, 20, 32], "float32"], ["TENSOR", [512, 20, 32], "float32"], [512, 20, 20]], {}], "config": {"index": 15368, "code_hash": null, "entity": [["tile_y", "sp", [-1, 4, 5]], ["tile_x", "sp", [-1, 2, 2]], ["tile_k", "sp", [-1, 32]], ["auto_unroll_max_step", "ot", 64], ["unroll_explicit", "ot", 1]]}, "result": [[3.0045605662100457e-05], 0, 1.4395310878753662, 1629032888.9264758], "version": 0.2, "tvm_version": "0.8.dev0"}
{"input": ["cuda -keys=cuda,gpu -max_num_threads=1024 -model=unknown -thread_warp_size=32", "batch_matmul.cuda", [["TENSOR", [512, 20, 32], "float32"], ["TENSOR", [512, 20, 32], "float32"], [512, 20, 20]], {}], "config": {"index": 8471, "code_hash": null, "entity": [["tile_y", "sp", [-1, 5, 4]], ["tile_x", "sp", [-1, 4, 1]], ["tile_k", "sp", [-1, 4]], ["auto_unroll_max_step", "ot", 8], ["unroll_explicit", "ot", 1]]}, "result": [[1.825139756206665e-05], 0, 1.4443466663360596, 1629032889.745688], "version": 0.2, "tvm_version": "0.8.dev0"}
{"input": ["cuda -keys=cuda,gpu -max_num_threads=1024 -model=unknown -thread_warp_size=32", "batch_matmul.cuda", [["TENSOR", [512, 20, 32], "float32"], ["TENSOR", [512, 20, 32], "float32"], [512, 20, 20]], {}], "config": {"index": 4608, "code_hash": null, "entity": [["tile_y", "sp", [-1, 1, 1]], ["tile_x", "sp", [-1, 10, 1]], ["tile_k", "sp", [-1, 4]], ["auto_unroll_max_step", "ot", 32], ["unroll_explicit", "ot", 0]]}, "result": [[0.00011802632528409091], 0, 1.3939793109893799, 1629032890.5904286], "version": 0.2, "tvm_version": "0.8.dev0"}
{"input": ["cuda -keys=cuda,gpu -max_num_threads=1024 -model=unknown -thread_warp_size=32", "batch_matmul.cuda", [["TENSOR", [512, 20, 32], "float32"], ["TENSOR", [512, 20, 32], "float32"], [512, 20, 20]], {}], "config": {"index": 14152, "code_hash": null, "entity": [["tile_y", "sp", [-1, 10, 1]], ["tile_x", "sp", [-1, 1, 5]], ["tile_k", "sp", [-1, 2]], ["auto_unroll_max_step", "ot", 64], ["unroll_explicit", "ot", 1]]}, "result": [[4.7156211701526285e-05], 0, 1.3454246520996094, 1629032891.4341273], "version": 0.2, "tvm_version": "0.8.dev0"}
{"input": ["cuda -keys=cuda,gpu -max_num_threads=1024 -model=unknown -thread_warp_size=32", "batch_matmul.cuda", [["TENSOR", [512, 20, 32], "float32"], ["TENSOR", [512, 20, 32], "float32"], [512, 20, 20]], {}], "config": {"index": 753, "code_hash": null, "entity": [["tile_y", "sp", [-1, 1, 10]], ["tile_x", "sp", [-1, 20, 1]], ["tile_k", "sp", [-1, 4]], ["auto_unroll_max_step", "ot", 8], ["unroll_explicit", "ot", 0]]}, "result": [[1.9607950280865303e-05], 0, 1.3034048080444336, 1629032892.2634053], "version": 0.2, "tvm_version": "0.8.dev0"}
{"input": ["cuda -keys=cuda,gpu -max_num_threads=1024 -model=unknown -thread_warp_size=32", "batch_matmul.cuda", [["TENSOR", [512, 20, 32], "float32"], ["TENSOR", [512, 20, 32], "float32"], [512, 20, 20]], {}], "config": {"index": 8467, "code_hash": null, "entity": [["tile_y", "sp", [-1, 2, 2]], ["tile_x", "sp", [-1, 4, 1]], ["tile_k", "sp", [-1, 4]], ["auto_unroll_max_step", "ot", 8], ["unroll_explicit", "ot", 1]]}, "result": [[3.623062519100633e-05], 0, 1.2348606586456299, 1629032893.0999851], "version": 0.2, "tvm_version": "0.8.dev0"}
{"input": ["cuda -keys=cuda,gpu -max_num_threads=1024 -model=unknown -thread_warp_size=32", "batch_matmul.cuda", [["TENSOR", [512, 20, 32], "float32"], ["TENSOR", [512, 20, 32], "float32"], [512, 20, 20]], {}], "config": {"index": 14222, "code_hash": null, "entity": [["tile_y", "sp", [-1, 4, 1]], ["tile_x", "sp", [-1, 2, 10]], ["tile_k", "sp", [-1, 2]], ["auto_unroll_max_step", "ot", 64], ["unroll_explicit", "ot", 1]]}, "result": [[2.7812862337960303e-05], 0, 1.4217174053192139, 1629032895.8501542], "version": 0.2, "tvm_version": "0.8.dev0"}
{"input": ["cuda -keys=cuda,gpu -max_num_threads=1024 -model=unknown -thread_warp_size=32", "batch_matmul.cuda", [["TENSOR", [512, 20, 32], "float32"], ["TENSOR", [512, 20, 32], "float32"], [512, 20, 20]], {}], "config": {"index": 8029, "code_hash": null, "entity": [["tile_y", "sp", [-1, 2, 1]], ["tile_x", "sp", [-1, 4, 5]], ["tile_k", "sp", [-1, 1]], ["auto_unroll_max_step", "ot", 8], ["unroll_explicit", "ot", 1]]}, "result": [[0.0001239135278810409], 0, 1.1272530555725098, 1629032896.6946208], "version": 0.2, "tvm_version": "0.8.dev0"}
{"input": ["cuda -keys=cuda,gpu -max_num_threads=1024 -model=unknown -thread_warp_size=32", "batch_matmul.cuda", [["TENSOR", [512, 20, 32], "float32"], ["TENSOR", [512, 20, 32], "float32"], [512, 20, 20]], {}], "config": {"index": 768, "code_hash": null, "entity": [["tile_y", "sp", [-1, 1, 5]], ["tile_x", "sp", [-1, 1, 2]], ["tile_k", "sp", [-1, 4]], ["auto_unroll_max_step", "ot", 8], ["unroll_explicit", "ot", 0]]}, "result": [[0.00019513300692840647], 0, 1.3057174682617188, 1629032897.555706], "version": 0.2, "tvm_version": "0.8.dev0"}
{"input": ["cuda -keys=cuda,gpu -max_num_threads=1024 -model=unknown -thread_warp_size=32", "batch_matmul.cuda", [["TENSOR", [512, 20, 32], "float32"], ["TENSOR", [512, 20, 32], "float32"], [512, 20, 20]], {}], "config": {"index": 13192, "code_hash": null, "entity": [["tile_y", "sp", [-1, 2, 10]], ["tile_x", "sp", [-1, 1, 5]], ["tile_k", "sp", [-1, 16]], ["auto_unroll_max_step", "ot", 32], ["unroll_explicit", "ot", 1]]}, "result": [[4.93415132243685e-05], 0, 1.5551393032073975, 1629032898.4448059], "version": 0.2, "tvm_version": "0.8.dev0"}
{"input": ["cuda -keys=cuda,gpu -max_num_threads=1024 -model=unknown -thread_warp_size=32", "batch_matmul.cuda", [["TENSOR", [512, 20, 32], "float32"], ["TENSOR", [512, 20, 32], "float32"], [512, 20, 20]], {}], "config": {"index": 6074, "code_hash": null, "entity": [["tile_y", "sp", [-1, 5, 2]], ["tile_x", "sp", [-1, 2, 5]], ["tile_k", "sp", [-1, 1]], ["auto_unroll_max_step", "ot", 64], ["unroll_explicit", "ot", 0]]}, "result": [[3.800913887609397e-05], 0, 1.3423402309417725, 1629032899.2781641], "version": 0.2, "tvm_version": "0.8.dev0"}
{"input": ["cuda -keys=cuda,gpu -max_num_threads=1024 -model=unknown -thread_warp_size=32", "batch_matmul.cuda", [["TENSOR", [512, 20, 32], "float32"], ["TENSOR", [512, 20, 32], "float32"], [512, 20, 20]], {}], "config": {"index": 13291, "code_hash": null, "entity": [["tile_y", "sp", [-1, 2, 2]], ["tile_x", "sp", [-1, 1, 1]], ["tile_k", "sp", [-1, 32]], ["auto_unroll_max_step", "ot", 32], ["unroll_explicit", "ot", 1]]}, "result": [[0.00019382686296900487], 0, 1.8993651866912842, 1629032900.4848952], "version": 0.2, "tvm_version": "0.8.dev0"}
{"input": ["cuda -keys=cuda,gpu -max_num_threads=1024 -model=unknown -thread_warp_size=32", "batch_matmul.cuda", [["TENSOR", [512, 20, 32], "float32"], ["TENSOR", [512, 20, 32], "float32"], [512, 20, 20]], {}], "config": {"index": 3254, "code_hash": null, "entity": [["tile_y", "sp", [-1, 4, 5]], ["tile_x", "sp", [-1, 1, 1]], ["tile_k", "sp", [-1, 16]], ["auto_unroll_max_step", "ot", 16], ["unroll_explicit", "ot", 0]]}, "result": [[0.00011279752303523036], 0, 1.3390395641326904, 1629032901.33667], "version": 0.2, "tvm_version": "0.8.dev0"}
{"input": ["cuda -keys=cuda,gpu -max_num_threads=1024 -model=unknown -thread_warp_size=32", "batch_matmul.cuda", [["TENSOR", [512, 20, 32], "float32"], ["TENSOR", [512, 20, 32], "float32"], [512, 20, 20]], {}], "config": {"index": 4624, "code_hash": null, "entity": [["tile_y", "sp", [-1, 2, 10]], ["tile_x", "sp", [-1, 10, 1]], ["tile_k", "sp", [-1, 4]], ["auto_unroll_max_step", "ot", 32], ["unroll_explicit", "ot", 0]]}, "result": [[1.2302108835311011e-05], 0, 1.3624281883239746, 1629032902.170113], "version": 0.2, "tvm_version": "0.8.dev0"}
{"input": ["cuda -keys=cuda,gpu -max_num_threads=1024 -model=unknown -thread_warp_size=32", "batch_matmul.cuda", [["TENSOR", [512, 20, 32], "float32"], ["TENSOR", [512, 20, 32], "float32"], [512, 20, 20]], {}], "config": {"index": 5706, "code_hash": null, "entity": [["tile_y", "sp", [-1, 1, 1]], ["tile_x", "sp", [-1, 5, 4]], ["tile_k", "sp", [-1, 32]], ["auto_unroll_max_step", "ot", 32], ["unroll_explicit", "ot", 0]]}, "result": [[9.201624619565217e-05], 0, 1.4241750240325928, 1629032903.0287108], "version": 0.2, "tvm_version": "0.8.dev0"}
{"input": ["cuda -keys=cuda,gpu -max_num_threads=1024 -model=unknown -thread_warp_size=32", "batch_matmul.cuda", [["TENSOR", [512, 20, 32], "float32"], ["TENSOR", [512, 20, 32], "float32"], [512, 20, 20]], {}], "config": {"index": 4036, "code_hash": null, "entity": [["tile_y", "sp", [-1, 10, 1]], ["tile_x", "sp", [-1, 5, 2]], ["tile_k", "sp", [-1, 1]], ["auto_unroll_max_step", "ot", 32], ["unroll_explicit", "ot", 0]]}, "result": [[3.6871317170818506e-05], 0, 1.3354833126068115, 1629032903.8528066], "version": 0.2, "tvm_version": "0.8.dev0"}
{"input": ["cuda -keys=cuda,gpu -max_num_threads=1024 -model=unknown -thread_warp_size=32", "batch_matmul.cuda", [["TENSOR", [512, 20, 32], "float32"], ["TENSOR", [512, 20, 32], "float32"], [512, 20, 20]], {}], "config": {"index": 12511, "code_hash": null, "entity": [["tile_y", "sp", [-1, 2, 1]], ["tile_x", "sp", [-1, 5, 4]], ["tile_k", "sp", [-1, 4]], ["auto_unroll_max_step", "ot", 32], ["unroll_explicit", "ot", 1]]}, "result": [[3.49141994895789e-05], 0, 1.30210280418396, 1629032904.674956], "version": 0.2, "tvm_version": "0.8.dev0"}
{"input": ["cuda -keys=cuda,gpu -max_num_threads=1024 -model=unknown -thread_warp_size=32", "batch_matmul.cuda", [["TENSOR", [512, 20, 32], "float32"], ["TENSOR", [512, 20, 32], "float32"], [512, 20, 20]], {}], "config": {"index": 10123, "code_hash": null, "entity": [["tile_y", "sp", [-1, 2, 2]], ["tile_x", "sp", [-1, 10, 1]], ["tile_k", "sp", [-1, 2]], ["auto_unroll_max_step", "ot", 16], ["unroll_explicit", "ot", 1]]}, "result": [[3.998251417303426e-05], 0, 1.215508222579956, 1629032905.5039387], "version": 0.2, "tvm_version": "0.8.dev0"}
{"input": ["cuda -keys=cuda,gpu -max_num_threads=1024 -model=unknown -thread_warp_size=32", "batch_matmul.cuda", [["TENSOR", [512, 20, 32], "float32"], ["TENSOR", [512, 20, 32], "float32"], [512, 20, 20]], {}], "config": {"index": 4021, "code_hash": null, "entity": [["tile_y", "sp", [-1, 2, 2]], ["tile_x", "sp", [-1, 2, 2]], ["tile_k", "sp", [-1, 1]], ["auto_unroll_max_step", "ot", 32], ["unroll_explicit", "ot", 0]]}, "result": [[0.0001282069269051322], 0, 1.0134665966033936, 1629032907.9432483], "version": 0.2, "tvm_version": "0.8.dev0"}
{"input": ["cuda -keys=cuda,gpu -max_num_threads=1024 -model=unknown -thread_warp_size=32", "batch_matmul.cuda", [["TENSOR", [512, 20, 32], "float32"], ["TENSOR", [512, 20, 32], "float32"], [512, 20, 20]], {}], "config": {"index": 13450, "code_hash": null, "entity": [["tile_y", "sp", [-1, 10, 1]], ["tile_x", "sp", [-1, 10, 2]], ["tile_k", "sp", [-1, 32]], ["auto_unroll_max_step", "ot", 32], ["unroll_explicit", "ot", 1]]}, "result": [[2.6450228974234324e-05], 0, 1.0913283824920654, 1629032908.7482438], "version": 0.2, "tvm_version": "0.8.dev0"}
{"input": ["cuda -keys=cuda,gpu -max_num_threads=1024 -model=unknown -thread_warp_size=32", "batch_matmul.cuda", [["TENSOR", [512, 20, 32], "float32"], ["TENSOR", [512, 20, 32], "float32"], [512, 20, 20]], {}], "config": {"index": 566, "code_hash": null, "entity": [["tile_y", "sp", [-1, 5, 2]], ["tile_x", "sp", [-1, 2, 5]], ["tile_k", "sp", [-1, 2]], ["auto_unroll_max_step", "ot", 8], ["unroll_explicit", "ot", 0]]}, "result": [[1.98539205903879e-05], 0, 1.2379908561706543, 1629032909.5530322], "version": 0.2, "tvm_version": "0.8.dev0"}
{"input": ["cuda -keys=cuda,gpu -max_num_threads=1024 -model=unknown -thread_warp_size=32", "batch_matmul.cuda", [["TENSOR", [512, 20, 32], "float32"], ["TENSOR", [512, 20, 32], "float32"], [512, 20, 20]], {}], "config": {"index": 5810, "code_hash": null, "entity": [["tile_y", "sp", [-1, 4, 5]], ["tile_x", "sp", [-1, 2, 10]], ["tile_k", "sp", [-1, 32]], ["auto_unroll_max_step", "ot", 32], ["unroll_explicit", "ot", 0]]}, "result": [[1.691143325454732e-05], 0, 1.3540985584259033, 1629032910.4245627], "version": 0.2, "tvm_version": "0.8.dev0"}
{"input": ["cuda -keys=cuda,gpu -max_num_threads=1024 -model=unknown -thread_warp_size=32", "batch_matmul.cuda", [["TENSOR", [512, 20, 32], "float32"], ["TENSOR", [512, 20, 32], "float32"], [512, 20, 20]], {}], "config": {"index": 8930, "code_hash": null, "entity": [["tile_y", "sp", [-1, 4, 1]], ["tile_x", "sp", [-1, 1, 4]], ["tile_k", "sp", [-1, 8]], ["auto_unroll_max_step", "ot", 8], ["unroll_explicit", "ot", 1]]}, "result": [[6.152045205479452e-05], 0, 1.3848958015441895, 1629032911.2586484], "version": 0.2, "tvm_version": "0.8.dev0"}
{"input": ["cuda -keys=cuda,gpu -max_num_threads=1024 -model=unknown -thread_warp_size=32", "batch_matmul.cuda", [["TENSOR", [512, 20, 32], "float32"], ["TENSOR", [512, 20, 32], "float32"], [512, 20, 20]], {}], "config": {"index": 2022, "code_hash": null, "entity": [["tile_y", "sp", [-1, 1, 2]], ["tile_x", "sp", [-1, 10, 1]], ["tile_k", "sp", [-1, 1]], ["auto_unroll_max_step", "ot", 16], ["unroll_explicit", "ot", 0]]}, "result": [[0.00022993265205479448], 0, 1.3256309032440186, 1629032912.1122997], "version": 0.2, "tvm_version": "0.8.dev0"}
{"input": ["cuda -keys=cuda,gpu -max_num_threads=1024 -model=unknown -thread_warp_size=32", "batch_matmul.cuda", [["TENSOR", [512, 20, 32], "float32"], ["TENSOR", [512, 20, 32], "float32"], [512, 20, 20]], {}], "config": {"index": 3382, "code_hash": null, "entity": [["tile_y", "sp", [-1, 2, 10]], ["tile_x", "sp", [-1, 2, 2]], ["tile_k", "sp", [-1, 16]], ["auto_unroll_max_step", "ot", 16], ["unroll_explicit", "ot", 0]]}, "result": [[3.529178871794872e-05], 0, 1.4239954948425293, 1629032912.9661965], "version": 0.2, "tvm_version": "0.8.dev0"}
{"input": ["cuda -keys=cuda,gpu -max_num_threads=1024 -model=unknown -thread_warp_size=32", "batch_matmul.cuda", [["TENSOR", [512, 20, 32], "float32"], ["TENSOR", [512, 20, 32], "float32"], [512, 20, 20]], {}], "config": {"index": 4216, "code_hash": null, "entity": [["tile_y", "sp", [-1, 10, 1]], ["tile_x", "sp", [-1, 1, 1]], ["tile_k", "sp", [-1, 2]], ["auto_unroll_max_step", "ot", 32], ["unroll_explicit", "ot", 0]]}, "result": [[0.00017990902157497305], 0, 1.3033580780029297, 1629032913.817475], "version": 0.2, "tvm_version": "0.8.dev0"}
{"input": ["cuda -keys=cuda,gpu -max_num_threads=1024 -model=unknown -thread_warp_size=32", "batch_matmul.cuda", [["TENSOR", [512, 20, 32], "float32"], ["TENSOR", [512, 20, 32], "float32"], [512, 20, 20]], {}], "config": {"index": 3039, "code_hash": null, "entity": [["tile_y", "sp", [-1, 1, 10]], ["tile_x", "sp", [-1, 1, 2]], ["tile_k", "sp", [-1, 8]], ["auto_unroll_max_step", "ot", 16], ["unroll_explicit", "ot", 0]]}, "result": [[0.00016413493418467582], 0, 1.567199945449829, 1629032914.6732767], "version": 0.2, "tvm_version": "0.8.dev0"}
{"input": ["cuda -keys=cuda,gpu -max_num_threads=1024 -model=unknown -thread_warp_size=32", "batch_matmul.cuda", [["TENSOR", [512, 20, 32], "float32"], ["TENSOR", [512, 20, 32], "float32"], [512, 20, 20]], {}], "config": {"index": 1524, "code_hash": null, "entity": [["tile_y", "sp", [-1, 1, 5]], ["tile_x", "sp", [-1, 1, 5]], ["tile_k", "sp", [-1, 16]], ["auto_unroll_max_step", "ot", 8], ["unroll_explicit", "ot", 0]]}, "result": [[0.00011202485522788204], 0, 1.484321117401123, 1629032915.556825], "version": 0.2, "tvm_version": "0.8.dev0"}
{"input": ["cuda -keys=cuda,gpu -max_num_threads=1024 -model=unknown -thread_warp_size=32", "batch_matmul.cuda", [["TENSOR", [512, 20, 32], "float32"], ["TENSOR", [512, 20, 32], "float32"], [512, 20, 20]], {}], "config": {"index": 12998, "code_hash": null, "entity": [["tile_y", "sp", [-1, 4, 1]], ["tile_x", "sp", [-1, 4, 1]], ["tile_k", "sp", [-1, 16]], ["auto_unroll_max_step", "ot", 32], ["unroll_explicit", "ot", 1]]}, "result": [[2.4721901123263376e-05], 0, 1.2356016635894775, 1629032916.3934426], "version": 0.2, "tvm_version": "0.8.dev0"}
{"input": ["cuda -keys=cuda,gpu -max_num_threads=1024 -model=unknown -thread_warp_size=32", "batch_matmul.cuda", [["TENSOR", [512, 20, 32], "float32"], ["TENSOR", [512, 20, 32], "float32"], [512, 20, 20]], {}], "config": {"index": 9880, "code_hash": null, "entity": [["tile_y", "sp", [-1, 2, 10]], ["tile_x", "sp", [-1, 5, 2]], ["tile_k", "sp", [-1, 1]], ["auto_unroll_max_step", "ot", 16], ["unroll_explicit", "ot", 1]]}, "result": [[3.645591797827532e-05], 0, 1.3639726638793945, 1629032917.239855], "version": 0.2, "tvm_version": "0.8.dev0"}
{"input": ["cuda -keys=cuda,gpu -max_num_threads=1024 -model=unknown -thread_warp_size=32", "batch_matmul.cuda", [["TENSOR", [512, 20, 32], "float32"], ["TENSOR", [512, 20, 32], "float32"], [512, 20, 20]], {}], "config": {"index": 5609, "code_hash": null, "entity": [["tile_y", "sp", [-1, 5, 4]], ["tile_x", "sp", [-1, 20, 1]], ["tile_k", "sp", [-1, 32]], ["auto_unroll_max_step", "ot", 32], ["unroll_explicit", "ot", 0]]}, "result": [[1.0662593433089853e-05], 0, 1.2461161613464355, 1629032927.474431], "version": 0.2, "tvm_version": "0.8.dev0"}
{"input": ["cuda -keys=cuda,gpu -max_num_threads=1024 -model=unknown -thread_warp_size=32", "batch_matmul.cuda", [["TENSOR", [512, 20, 32], "float32"], ["TENSOR", [512, 20, 32], "float32"], [512, 20, 20]], {}], "config": {"index": 1721, "code_hash": null, "entity": [["tile_y", "sp", [-1, 5, 4]], ["tile_x", "sp", [-1, 20, 1]], ["tile_k", "sp", [-1, 32]], ["auto_unroll_max_step", "ot", 8], ["unroll_explicit", "ot", 0]]}, "result": [[1.0339592106971308e-05], 0, 1.0412375926971436, 1629032928.2655296], "version": 0.2, "tvm_version": "0.8.dev0"}
{"input": ["cuda -keys=cuda,gpu -max_num_threads=1024 -model=unknown -thread_warp_size=32", "batch_matmul.cuda", [["TENSOR", [512, 20, 32], "float32"], ["TENSOR", [512, 20, 32], "float32"], [512, 20, 20]], {}], "config": {"index": 3665, "code_hash": null, "entity": [["tile_y", "sp", [-1, 5, 4]], ["tile_x", "sp", [-1, 20, 1]], ["tile_k", "sp", [-1, 32]], ["auto_unroll_max_step", "ot", 16], ["unroll_explicit", "ot", 0]]}, "result": [[1.0354450826019619e-05], 0, 1.0940241813659668, 1629032929.0331745], "version": 0.2, "tvm_version": "0.8.dev0"}
{"input": ["cuda -keys=cuda,gpu -max_num_threads=1024 -model=unknown -thread_warp_size=32", "batch_matmul.cuda", [["TENSOR", [512, 20, 32], "float32"], ["TENSOR", [512, 20, 32], "float32"], [512, 20, 20]], {}], "config": {"index": 7553, "code_hash": null, "entity": [["tile_y", "sp", [-1, 5, 4]], ["tile_x", "sp", [-1, 20, 1]], ["tile_k", "sp", [-1, 32]], ["auto_unroll_max_step", "ot", 64], ["unroll_explicit", "ot", 0]]}, "result": [[1.0342838611685625e-05], 0, 1.2833232879638672, 1629032929.816862], "version": 0.2, "tvm_version": "0.8.dev0"}
{"input": ["cuda -keys=cuda,gpu -max_num_threads=1024 -model=unknown -thread_warp_size=32", "batch_matmul.cuda", [["TENSOR", [512, 20, 32], "float32"], ["TENSOR", [512, 20, 32], "float32"], [512, 20, 20]], {}], "config": {"index": 5612, "code_hash": null, "entity": [["tile_y", "sp", [-1, 4, 5]], ["tile_x", "sp", [-1, 20, 1]], ["tile_k", "sp", [-1, 32]], ["auto_unroll_max_step", "ot", 32], ["unroll_explicit", "ot", 0]]}, "result": [[1.4866476365642817e-05], 0, 1.296318769454956, 1629032930.6300218], "version": 0.2, "tvm_version": "0.8.dev0"}
{"input": ["cuda -keys=cuda,gpu -max_num_threads=1024 -model=unknown -thread_warp_size=32", "batch_matmul.cuda", [["TENSOR", [512, 20, 32], "float32"], ["TENSOR", [512, 20, 32], "float32"], [512, 20, 20]], {}], "config": {"index": 1724, "code_hash": null, "entity": [["tile_y", "sp", [-1, 4, 5]], ["tile_x", "sp", [-1, 20, 1]], ["tile_k", "sp", [-1, 32]], ["auto_unroll_max_step", "ot", 8], ["unroll_explicit", "ot", 0]]}, "result": [[1.4819666788287877e-05], 0, 1.360130786895752, 1629032931.4199903], "version": 0.2, "tvm_version": "0.8.dev0"}
{"input": ["cuda -keys=cuda,gpu -max_num_threads=1024 -model=unknown -thread_warp_size=32", "batch_matmul.cuda", [["TENSOR", [512, 20, 32], "float32"], ["TENSOR", [512, 20, 32], "float32"], [512, 20, 20]], {}], "config": {"index": 5614, "code_hash": null, "entity": [["tile_y", "sp", [-1, 2, 10]], ["tile_x", "sp", [-1, 20, 1]], ["tile_k", "sp", [-1, 32]], ["auto_unroll_max_step", "ot", 32], ["unroll_explicit", "ot", 0]]}, "result": [[8.0710919851028e-06], 0, 1.4132816791534424, 1629032932.189136], "version": 0.2, "tvm_version": "0.8.dev0"}
{"input": ["cuda -keys=cuda,gpu -max_num_threads=1024 -model=unknown -thread_warp_size=32", "batch_matmul.cuda", [["TENSOR", [512, 20, 32], "float32"], ["TENSOR", [512, 20, 32], "float32"], [512, 20, 20]], {}], "config": {"index": 1726, "code_hash": null, "entity": [["tile_y", "sp", [-1, 2, 10]], ["tile_x", "sp", [-1, 20, 1]], ["tile_k", "sp", [-1, 32]], ["auto_unroll_max_step", "ot", 8], ["unroll_explicit", "ot", 0]]}, "result": [[8.148055668491009e-06], 0, 1.3572893142700195, 1629032932.9693372], "version": 0.2, "tvm_version": "0.8.dev0"}
{"input": ["cuda -keys=cuda,gpu -max_num_threads=1024 -model=unknown -thread_warp_size=32", "batch_matmul.cuda", [["TENSOR", [512, 20, 32], "float32"], ["TENSOR", [512, 20, 32], "float32"], [512, 20, 20]], {}], "config": {"index": 3668, "code_hash": null, "entity": [["tile_y", "sp", [-1, 4, 5]], ["tile_x", "sp", [-1, 20, 1]], ["tile_k", "sp", [-1, 32]], ["auto_unroll_max_step", "ot", 16], ["unroll_explicit", "ot", 0]]}, "result": [[1.5054312161541992e-05], 0, 1.298781156539917, 1629032933.7764866], "version": 0.2, "tvm_version": "0.8.dev0"}
{"input": ["cuda -keys=cuda,gpu -max_num_threads=1024 -model=unknown -thread_warp_size=32", "batch_matmul.cuda", [["TENSOR", [512, 20, 32], "float32"], ["TENSOR", [512, 20, 32], "float32"], [512, 20, 20]], {}], "config": {"index": 3670, "code_hash": null, "entity": [["tile_y", "sp", [-1, 2, 10]], ["tile_x", "sp", [-1, 20, 1]], ["tile_k", "sp", [-1, 32]], ["auto_unroll_max_step", "ot", 16], ["unroll_explicit", "ot", 0]]}, "result": [[8.195049701484922e-06], 0, 1.313520908355713, 1629032934.5612307], "version": 0.2, "tvm_version": "0.8.dev0"}
{"input": ["cuda -keys=cuda,gpu -max_num_threads=1024 -model=unknown -thread_warp_size=32", "batch_matmul.cuda", [["TENSOR", [512, 20, 32], "float32"], ["TENSOR", [512, 20, 32], "float32"], [512, 20, 20]], {}], "config": {"index": 1397, "code_hash": null, "entity": [["tile_y", "sp", [-1, 5, 4]], ["tile_x", "sp", [-1, 20, 1]], ["tile_k", "sp", [-1, 16]], ["auto_unroll_max_step", "ot", 8], ["unroll_explicit", "ot", 0]]}, "result": [[8.382923300560314e-06], 0, 1.2443442344665527, 1629032935.3703368], "version": 0.2, "tvm_version": "0.8.dev0"}
{"input": ["cuda -keys=cuda,gpu -max_num_threads=1024 -model=unknown -thread_warp_size=32", "batch_matmul.cuda", [["TENSOR", [512, 20, 32], "float32"], ["TENSOR", [512, 20, 32], "float32"], [512, 20, 20]], {}], "config": {"index": 13385, "code_hash": null, "entity": [["tile_y", "sp", [-1, 5, 4]], ["tile_x", "sp", [-1, 20, 1]], ["tile_k", "sp", [-1, 32]], ["auto_unroll_max_step", "ot", 32], ["unroll_explicit", "ot", 1]]}, "result": [[1.0585270222628453e-05], 0, 1.1575987339019775, 1629032936.1418386], "version": 0.2, "tvm_version": "0.8.dev0"}
{"input": ["cuda -keys=cuda,gpu -max_num_threads=1024 -model=unknown -thread_warp_size=32", "batch_matmul.cuda", [["TENSOR", [512, 20, 32], "float32"], ["TENSOR", [512, 20, 32], "float32"], [512, 20, 20]], {}], "config": {"index": 5285, "code_hash": null, "entity": [["tile_y", "sp", [-1, 5, 4]], ["tile_x", "sp", [-1, 20, 1]], ["tile_k", "sp", [-1, 16]], ["auto_unroll_max_step", "ot", 32], ["unroll_explicit", "ot", 0]]}, "result": [[8.448105619747899e-06], 0, 1.0435762405395508, 1629032938.546679], "version": 0.2, "tvm_version": "0.8.dev0"}
{"input": ["cuda -keys=cuda,gpu -max_num_threads=1024 -model=unknown -thread_warp_size=32", "batch_matmul.cuda", [["TENSOR", [512, 20, 32], "float32"], ["TENSOR", [512, 20, 32], "float32"], [512, 20, 20]], {}], "config": {"index": 3341, "code_hash": null, "entity": [["tile_y", "sp", [-1, 5, 4]], ["tile_x", "sp", [-1, 20, 1]], ["tile_k", "sp", [-1, 16]], ["auto_unroll_max_step", "ot", 16], ["unroll_explicit", "ot", 0]]}, "result": [[8.780622086864407e-06], 0, 1.0619549751281738, 1629032939.3636034], "version": 0.2, "tvm_version": "0.8.dev0"}
{"input": ["cuda -keys=cuda,gpu -max_num_threads=1024 -model=unknown -thread_warp_size=32", "batch_matmul.cuda", [["TENSOR", [512, 20, 32], "float32"], ["TENSOR", [512, 20, 32], "float32"], [512, 20, 20]], {}], "config": {"index": 5270, "code_hash": null, "entity": [["tile_y", "sp", [-1, 4, 5]], ["tile_x", "sp", [-1, 10, 1]], ["tile_k", "sp", [-1, 16]], ["auto_unroll_max_step", "ot", 32], ["unroll_explicit", "ot", 0]]}, "result": [[1.2059036696562031e-05], 0, 1.2155635356903076, 1629032940.1799197], "version": 0.2, "tvm_version": "0.8.dev0"}
{"input": ["cuda -keys=cuda,gpu -max_num_threads=1024 -model=unknown -thread_warp_size=32", "batch_matmul.cuda", [["TENSOR", [512, 20, 32], "float32"], ["TENSOR", [512, 20, 32], "float32"], [512, 20, 20]], {}], "config": {"index": 11441, "code_hash": null, "entity": [["tile_y", "sp", [-1, 5, 4]], ["tile_x", "sp", [-1, 20, 1]], ["tile_k", "sp", [-1, 32]], ["auto_unroll_max_step", "ot", 16], ["unroll_explicit", "ot", 1]]}, "result": [[1.0472705280312907e-05], 0, 1.2263567447662354, 1629032940.9445975], "version": 0.2, "tvm_version": "0.8.dev0"}
{"input": ["cuda -keys=cuda,gpu -max_num_threads=1024 -model=unknown -thread_warp_size=32", "batch_matmul.cuda", [["TENSOR", [512, 20, 32], "float32"], ["TENSOR", [512, 20, 32], "float32"], [512, 20, 20]], {}], "config": {"index": 1400, "code_hash": null, "entity": [["tile_y", "sp", [-1, 4, 5]], ["tile_x", "sp", [-1, 20, 1]], ["tile_k", "sp", [-1, 16]], ["auto_unroll_max_step", "ot", 8], ["unroll_explicit", "ot", 0]]}, "result": [[8.499240077236644e-06], 0, 1.2849602699279785, 1629032941.775771], "version": 0.2, "tvm_version": "0.8.dev0"}
{"input": ["cuda -keys=cuda,gpu -max_num_threads=1024 -model=unknown -thread_warp_size=32", "batch_matmul.cuda", [["TENSOR", [512, 20, 32], "float32"], ["TENSOR", [512, 20, 32], "float32"], [512, 20, 20]], {}], "config": {"index": 1382, "code_hash": null, "entity": [["tile_y", "sp", [-1, 4, 5]], ["tile_x", "sp", [-1, 10, 1]], ["tile_k", "sp", [-1, 16]], ["auto_unroll_max_step", "ot", 8], ["unroll_explicit", "ot", 0]]}, "result": [[1.2096596248325145e-05], 0, 1.3484225273132324, 1629032942.5760577], "version": 0.2, "tvm_version": "0.8.dev0"}
{"input": ["cuda -keys=cuda,gpu -max_num_threads=1024 -model=unknown -thread_warp_size=32", "batch_matmul.cuda", [["TENSOR", [512, 20, 32], "float32"], ["TENSOR", [512, 20, 32], "float32"], [512, 20, 20]], {}], "config": {"index": 7556, "code_hash": null, "entity": [["tile_y", "sp", [-1, 4, 5]], ["tile_x", "sp", [-1, 20, 1]], ["tile_k", "sp", [-1, 32]], ["auto_unroll_max_step", "ot", 64], ["unroll_explicit", "ot", 0]]}, "result": [[1.5019866394841646e-05], 0, 1.1910314559936523, 1629032943.3475957], "version": 0.2, "tvm_version": "0.8.dev0"}
{"input": ["cuda -keys=cuda,gpu -max_num_threads=1024 -model=unknown -thread_warp_size=32", "batch_matmul.cuda", [["TENSOR", [512, 20, 32], "float32"], ["TENSOR", [512, 20, 32], "float32"], [512, 20, 20]], {}], "config": {"index": 5288, "code_hash": null, "entity": [["tile_y", "sp", [-1, 4, 5]], ["tile_x", "sp", [-1, 20, 1]], ["tile_k", "sp", [-1, 16]], ["auto_unroll_max_step", "ot", 32], ["unroll_explicit", "ot", 0]]}, "result": [[8.48984370853898e-06], 0, 1.3054986000061035, 1629032944.1331685], "version": 0.2, "tvm_version": "0.8.dev0"}
{"input": ["cuda -keys=cuda,gpu -max_num_threads=1024 -model=unknown -thread_warp_size=32", "batch_matmul.cuda", [["TENSOR", [512, 20, 32], "float32"], ["TENSOR", [512, 20, 32], "float32"], [512, 20, 20]], {}], "config": {"index": 5290, "code_hash": null, "entity": [["tile_y", "sp", [-1, 2, 10]], ["tile_x", "sp", [-1, 20, 1]], ["tile_k", "sp", [-1, 16]], ["auto_unroll_max_step", "ot", 32], ["unroll_explicit", "ot", 0]]}, "result": [[7.748531583142374e-06], 0, 1.387366771697998, 1629032944.9457612], "version": 0.2, "tvm_version": "0.8.dev0"}
{"input": ["cuda -keys=cuda,gpu -max_num_threads=1024 -model=unknown -thread_warp_size=32", "batch_matmul.cuda", [["TENSOR", [512, 20, 32], "float32"], ["TENSOR", [512, 20, 32], "float32"], [512, 20, 20]], {}], "config": {"index": 3344, "code_hash": null, "entity": [["tile_y", "sp", [-1, 4, 5]], ["tile_x", "sp", [-1, 20, 1]], ["tile_k", "sp", [-1, 16]], ["auto_unroll_max_step", "ot", 16], ["unroll_explicit", "ot", 0]]}, "result": [[8.505877448625567e-06], 0, 1.2262358665466309, 1629032945.7474263], "version": 0.2, "tvm_version": "0.8.dev0"}
{"input": ["cuda -keys=cuda,gpu -max_num_threads=1024 -model=unknown -thread_warp_size=32", "batch_matmul.cuda", [["TENSOR", [512, 20, 32], "float32"], ["TENSOR", [512, 20, 32], "float32"], [512, 20, 20]], {}], "config": {"index": 3326, "code_hash": null, "entity": [["tile_y", "sp", [-1, 4, 5]], ["tile_x", "sp", [-1, 10, 1]], ["tile_k", "sp", [-1, 16]], ["auto_unroll_max_step", "ot", 16], ["unroll_explicit", "ot", 0]]}, "result": [[1.2003954952267302e-05], 0, 1.221864938735962, 1629032946.5306995], "version": 0.2, "tvm_version": "0.8.dev0"}
{"input": ["cuda -keys=cuda,gpu -max_num_threads=1024 -model=unknown -thread_warp_size=32", "batch_matmul.cuda", [["TENSOR", [512, 20, 32], "float32"], ["TENSOR", [512, 20, 32], "float32"], [512, 20, 20]], {}], "config": {"index": 1402, "code_hash": null, "entity": [["tile_y", "sp", [-1, 2, 10]], ["tile_x", "sp", [-1, 20, 1]], ["tile_k", "sp", [-1, 16]], ["auto_unroll_max_step", "ot", 8], ["unroll_explicit", "ot", 0]]}, "result": [[7.780532320872274e-06], 0, 1.1567480564117432, 1629032947.3260674], "version": 0.2, "tvm_version": "0.8.dev0"}
{"input": ["cuda -keys=cuda,gpu -max_num_threads=1024 -model=unknown -thread_warp_size=32", "batch_matmul.cuda", [["TENSOR", [512, 20, 32], "float32"], ["TENSOR", [512, 20, 32], "float32"], [512, 20, 20]], {}], "config": {"index": 3346, "code_hash": null, "entity": [["tile_y", "sp", [-1, 2, 10]], ["tile_x", "sp", [-1, 20, 1]], ["tile_k", "sp", [-1, 16]], ["auto_unroll_max_step", "ot", 16], ["unroll_explicit", "ot", 0]]}, "result": [[8.016211153696246e-06], 0, 1.4671075344085693, 1629032950.1864023], "version": 0.2, "tvm_version": "0.8.dev0"}
